ID;categorie;titres;liens_images;année;durée;score_recommendation;age_conseillé;description;prévention;mise_en_avant_supplémentaire;réalisation;distribution;scénariste;genres;avertissement_programme;recommendations;netflix_original;nombre_occurrence
81252357;Blockbusters;Don't Look Up : Déni cosmique;occ-0-2773-2774.1.nflxso.net/dnm/api/v6/6gmvu2hxdfnQ55LZZjyzYR4kzGk/AAAABTxLd8oQCpDKKrU0zV8eZxbjJpMUdL4njrULXenBmaFiE0hrf0q2wQgydAWhlatIDfo4EKZPAA9mNaZ1Y-p_GjHxjagwpKr852R4iuS8Ej2hC4SlhzO7Ol9S-3mCVX3Ut21-.jpg?r=8dd;2021;2 h 18 min;;13+;Deux astronomes méconnus entreprennent une tournée médiatique pour prévenir l'humanité qu'une comète fonce sur la Terre. Mais cela n'a pas l'air d'inquiéter grand monde.;;0;Adam McKay;Leonardo DiCaprio,Jennifer Lawrence,Meryl Streep,Cate Blanchett,Rob Morgan,Jonah Hill,Mark Rylance,Tyler Perry,Timothée Chalamet,Ariana Grande,Scott Mescudi,Michael Chiklis,Melanie Lynskey,Himesh Patel,Tomer Sisley,Paul Guilfoyle,Robert Joy;Adam McKay,David Sirota;Films SF,Films comiques,Drames sociaux;Insolite,Sombre;80244645,81030627,60024918,81064867,60011152,80206300,80158764,81040362,70305903,60024942,81165134,81458416,80196789,80117799,70208247,80067831,81010971,70230640,80015343,80167481,70132721,81140933,70108779,60021783,80207506,80236421;True;1
81253859;Blockbusters;Le dernier mercenaire;occ-0-2773-2774.1.nflxso.net/dnm/api/v6/6gmvu2hxdfnQ55LZZjyzYR4kzGk/AAAABQXslHPJfY9oJR1YRcalPfm2Fnbl0789rdQSwXa_wmpEBUOJ58VCEafFXQ2N3HQmnutFM5QScEs7e8ERN9Am8S5pQsSc8iiSCeqeu0EK44aq22ovC38f7sgMipMip5q8O78i.jpg?r=abb;2021;1 h 52 min;;13+;Un ex-agent secret sort de la clandestinité pour secourir le fils qu’il n’a jamais connu. Mais sa mission la plus difficile pourrait bien être de devenir père.;;0;David Charhon;Jean-Claude Van Damme,Alban Ivanov,Éric Judor,Patrick Timsit,Miou-Miou,Assa Sylla,Samir Decazza,Valérie Kaprisky,Djimo,Nassim Lyes;David Charhon,Ismaël Sy Savané;Français,Films comiques,Films d'action;;81030627,81233034,70056430,80232655,81171201,80073160,81290742,80993280,81557402,81416977,81587697,70127226,81108579,81185548,81212484,81005492,81509213,80191876,70208104,81073022,80098202,81319170,81043105,80099089,81227923,81005258;True;1
81256675;Séries saluées par la critique;Hellbound;occ-0-2773-2774.1.nflxso.net/dnm/api/v6/6gmvu2hxdfnQ55LZZjyzYR4kzGk/AAAABQwlLaDrTzCWbgRPv1b4bdGsGL7y8rALUL39sN_irxlruyRjHXoSmywWIMCNvL9cGFhtdq14A67oWw9O5MEBaTrhMmxyM5Y5M8f1D13R6fJTzsR9vtrqQGnaHEqjPcYT3BO3.jpg?r=942;2021;1 Saison;;16+;Des créatures venues d'ailleurs condamnent violemment les gens à l'enfer et favorisent l'émergence d'une secte religieuse fondée sur la théorie d'une justice divine.;violence;1;;Yoo Ah-in,Kim Hyun-joo,Park Jeong-min,Won Jin-a,Yang Ik-june,Kim Do-yoon,Kim Shin-rock,Ryu Kyung-soo,Lee Re;;Coréen,Séries d'intrigue,Dramas coréens inspirés de webtoons,Thrillers TV,Séries d'épouvante;Violent,Sombre,Suspense;80070182,81240831,80990668,80241947,70177057,81457374,81312457,81010699,81295011,81486809,81552615,81090386,81046394,81340251,81307048,81483306,80158577,81098012,80209229,80158148,81478985,80198988,81551869,81267787,81640988,81612863;True;1
81258637;Séries SF et fantastique|Films et séries du Royaume-Uni;Half Bad : Mal & Fils;occ-0-2773-2774.1.nflxso.net/dnm/api/v6/6gmvu2hxdfnQ55LZZjyzYR4kzGk/AAAABXq_xi5IUCFKWQLESKsmWWkAjCRsHPCkAMqHKzx2Vy6Q5xdUuOmgXKHLP8gLx4SudGRPrvI7mODEl8dZCwBvuF-MvFvalPEqTuu_xqSkRFGK-gdQlnaAe1sBoINgknyhkR_-.jpg?r=c09;2022;8 Épisodes;;16+;Pris en tenaille dans une guerre de clans, le fils d'un sorcier notoire responsable d'un massacre tente de se faire une place au soleil, et de maîtriser ses pouvoirs.;violence;0;;Jay Lycurgo,Nadia Parkes,Emilien Vekemans,Paul Ready,Isobel Jesper Jones,Karen Connell,Fehinti Balogun;;Britannique,Séries pour ados,Séries d'action et d'aventure,Séries fantastiques;Violent,Romantique;80232926,81252707,80241539,80242724,81156676,80084447,80241581,81397077,81213803,80189829,81279312,80221644,80223989,81043660,80218885,80218200,81037850,81213653,81150303,80244780,80057918,80220679,80241239,80222720,80238357,81488967,80121349,80199393,81116060,80236319,80241318,81612863,80189685;True;3
81260083;Inspiré de crimes réels;Meurtres sans ordonnance;occ-0-2773-2774.1.nflxso.net/dnm/api/v6/6gmvu2hxdfnQ55LZZjyzYR4kzGk/AAAABYbPIT5nArgYgXhtFEKCJvKjJK5ynSRMR0toyCCfm15unO6GqKpizrp3_w3253OgzSoqnUzHLsaOIvKTR5_YoDhX39pP6ip7RKzaw_2u03SCuVbBihg6GCZhGV074r7ePaDv.jpg?r=4bb;2022;2 h 3 min;;13+;Une infirmière en soins intensifs surmenée se repose sur un nouveau collègue extrêmement dévoué, jusqu'à ce que la mort inattendue d'une patiente éveille ses soupçons.;;0;Tobias Lindholm;Jessica Chastain,Eddie Redmayne,Nnamdi Asomugha,Noah Emmerich,Kim Dickens,Malik Yoba,Alix West Lefler;Krysty Wilson-Cairns;Films policiers,Thrillers,Films inspirés de livres,Thrillers policiers,Films inspirés de faits réels;Sombre;81225962,80073823,81477746,81453541,80992607,81481808,80223997,81621414,80223927,60026150,81028570,80242820,81092222,81370440,81028975,80206420,80049281,80240371,81346330,80176893,80207506,80241181,81198448,81521006,81205314,81058695;True;1
81260280;Films d'époque;À l'ouest rien de nouveau;occ-0-2773-2774.1.nflxso.net/dnm/api/v6/6gmvu2hxdfnQ55LZZjyzYR4kzGk/AAAABbXXv8N3NJ6PxJD-WKjj6MgwlChbRIHMK10BvCpnCtOO_CntUkUzS67pak7VnvsYO7pNSzJRd5oSApAsBaCoWUwFWP99j2XaolLdKkGjmGUKwJXrStUq7Arn3BrrIJvIBLNy.jpg?r=721;2022;2 h 28 min;Recommandé à 61 %;16+;Pendant la Première Guerre mondiale, Paul, 17 ans, rejoint le front de l'Ouest, mais sa ferveur initiale est bientôt foudroyée par la sinistre réalité de la vie dans les tranchées.;violence, suicide;0;Edward Berger;Felix Kammerer,Albrecht Schuch,Aaron Hilmer,Moritz Klaus,Edin Hasanović,Thibault De Montalembert,Daniel Brühl,Devid Striesow,Adrian Grünewald,Andreas Döhler,Jakob Schmidt,Friedrich Berger,Michael Wittenborn;Edward Berger,Lesley Paterson,Ian Stokell;Allemand,Drames allemands,Films sur l'armée,Drames,Films inspirés de livres;Violent,Sombre;70143836,60011663,81582615,80041653,81041495,80986885,80017529,60011152,80170278,81144852,81140931,70266110,80118916,70305907,81186240,81603987,81248111,81320168,80182016,81166791,80191608,81166149,80013871,80241181,80207506,80176893;True;1
81260283;Mondes épiques|Séries SF et fantastique;The King: Eternal Monarch;occ-0-2773-2774.1.nflxso.net/dnm/api/v6/6gmvu2hxdfnQ55LZZjyzYR4kzGk/AAAABZjCSSKKecW5TbMiM9i9pC98Sk_VlNmbzuN5L1Nd_P_N-ama6bhcIUI4AePog-A6igKkKuS7hfAIGXRwREltcjq900UVncbJ0F3C6HDywJ0INnJhUQvIRvDQLBxm3J13G6ch.jpg?r=257;2020;16 Épisodes;Recommandé à 68 %;16+;En Corée contemporaine, un empereur en mission franchit le portail d'un monde parallèle, et rencontre une jeune policière téméraire, qu'il intrigue immédiatement.;violence;0;;Lee Min-ho,Kim Go-eun,Woo Do‑hwan,Kim Kyung-nam,Jung Eun-chae,Lee Jung-jin,Kim Young-ok;;Coréen,Séries fantastiques;Émotion,Romantique;81243992,81012487,81042230,81365087,80123798,81486372,81612967,81503460,81033650,80986896,80025266,81473182,80214405,80188730,80188354,81649877,81008021,81572781,81518991,80188605,81005504,81205849,81406881,81610895,81483827,81422314,81463556,81267722,70213130;True;2
81261170;Séries à regarder sans modération|Ajouts des 12 derniers mois|Ça devrait vous plaire|Thrillers TV|Séries internationales|Les trouvailles du jour pour vous;En un battement;occ-0-2773-2774.1.nflxso.net/dnm/api/v6/6gmvu2hxdfnQ55LZZjyzYR4kzGk/AAAABRDjt6bv-DeaouSzwD50Z4nBd-dbDFxO9v_QZkNHfs6Kbq2k6LZnu-5XOYtznbkt9EXH_9xXBNABhCchCMS1svluJBX1Ef6LPCXAXsr7OMIY69q1xHD_MugqWraCJ2CoQmhI.jpg?r=1b2;2023;2 Saisons;;16+;Un homme déterminé à se venger de l'organisation de trafic d'organes responsable de la mort de son épouse s'éprend de la femme ayant reçu le cœur de cette dernière.;violence, violence sexuelle;0;Camilo Vega;Michel Brown,Ana Lucía Domínguez,Sebastián Martínez,Margarita Muñoz,Moisés Arizmendi,Valeria Emiliani,Julián Cerati,Juan Fernando Sánchez,Mauricio Cujar,Jacqueline Arenal,Laura Londoño,Julián Arango;;Colombien,Séries d'intrigue,Thrillers TV;Suspense;81332635,80197327,81481808,81324724,81033361,81397077,81161372,81252980,80111425,81279324,81473355,81167761,81557402,81576597,81495803,80210920,81494917,81660544,81288983,81437215,81090319,81317562,81486213,81478642,81166747,81211710,80240371,81397422,80176893,80241181,81580045,81205314,81612863;True;6
81264650;À regarder en un week-end|Inspiré de crimes réels|Documentaires|Séries policières;Catching Killers;occ-0-2773-2774.1.nflxso.net/dnm/api/v6/6gmvu2hxdfnQ55LZZjyzYR4kzGk/AAAABZ4geEQEuvtV9OkMpdhdcOzWAaVH8X9RpIFdjYObOjObEhCuTArrBDuufVyLbv2bCdS4jFTNHFy1hejlP4eVyVqBWUn2jQnDFTw81G9JPebAibXGEa6IwTSm6C2c1VDpgAMl.jpg?r=eb1;2022;2 Saisons;;16+;Dans cette série de crimes réels, les enquêteurs chargés de célèbres affaires de tueurs en série révèlent les détails poignants et glaçants de leur incroyable travail.;violence sexuelle, références à des violences sexuelles;5;;;;Séries policières,Séries documentaires,Séries US,Documentaires inspirés de crimes réels;Enquête,Suspense;80991050,81555750,80217818,81380540,81179778,81031682,81512108,81288561,81173345,81586873,80202283,81087537,81183727,80226612,81097791,81300060,81168281,80185065,81059887,81031373,81212487,81006619,80161702,81006684,81227735,81405883,81025701,81580822,81298614,81519789,80213588,81353946,81130130,81436777;True;5
81267689;À regarder en un week-end;Les Héritiers de la terre;occ-0-2773-2774.1.nflxso.net/dnm/api/v6/6gmvu2hxdfnQ55LZZjyzYR4kzGk/AAAABb0y3j68Jb7P0_sz-A_9aFUbdC-zJFJH36EPGtzy7IkryLYm1HRVkVKny0jP4U_8yTeYbyhDkAboybZjCKYUen_OdB6ZsIA16xdJKRdwXayBUMQzUbBHwvMG2k5qq-bMmYTT.jpg?r=ec2;2022;8 Épisodes;;16+;À Barcelone, au 14e siècle, le jeune et entreprenant Hugo Llor cherche à se faire un nom tout en respectant le serment qu'il a fait à la famille Estanyol.;violence, violence sexuelle;0;;Yon González,David Solans,Elena Rivera,Rodolfo Sancho,Arturo Sancho,María Rodríguez Soto,Mercedes León,Aria Bedmar,Michelle Jenner,Anna Moliner,Manel Sans,Bruna Cusí,Nancho Novo,Pol López,Marta Belaustegui,Críspulo Cabezas,Aitor Luna,Abel Folk,Clara Segura,Gabriela Andrada,Laia Fontán,Rosana Pastor,Fermí Reixach,Montserrat Alcoverro,Jesús Carroza;;Séries dramatiques,Espagnol,Séries inspirées de livres,Films d'époque;Doux-amer,Sombre,Émotion;70301870,81332635,81582615,81140933,80175352,70213223,81564749,81481539,80213020,80241181,80182016,80161728,80176893,80070050;True;1
81267722;Films d'époque;100 Days My Prince;occ-0-2773-2774.1.nflxso.net/dnm/api/v6/6gmvu2hxdfnQ55LZZjyzYR4kzGk/AAAABXroxS7xNTTRZWTL6-UFccn2uDyZSMbFsmKX5Fy7HxxAeMY472S2-dUeHaByz9JE73QVC3D8PJFALueH85oTkW6akN1jko_5tNk.webp?r=110;2018;16 Épisodes;;13+;Un prince héritier frappé d'amnésie découvre la vie de roturier et vit un amour inoubliable en tant que mari de la femme célibataire la plus âgée de Joseon.;;0;;Doh Kyung-soo,Nam Ji-hyun,Cho Seong-ha,Cho Han-cheul,Kim Seon-ho,Han So-hee;;Séries dramatiques romantiques,Séries dramatiques,Coréen,Films d'époque;Romantique;81116487,81672245,81033645,80998940,81482476,81435649,81503460,81211303,80986896,81279108,81159258,81473182,81167137,81260283,81649877,81518991,81161487,80031790,80196931,81472752,80991107,81093222,80178564,80093324,81422314,81463556;False;1
81270678;Films et séries en français|Séries comiques|Séries nostalgie|Pour se détendre|Les trouvailles du jour pour vous;H;occ-0-2773-2774.1.nflxso.net/dnm/api/v6/6gmvu2hxdfnQ55LZZjyzYR4kzGk/AAAABcwGOOpuX59asNz8dcBZSF1T2_Zc-t1gbMRbYx7JvnKJRwOK_afXwxByMd_dYAkFIRW7MsJ18-__w6M_QUAQxGvh--L0z2vAm38.webp?r=8f6;2002;4 Saisons;Recommandé à 86 %;13+;Dans un hôpital déjanté de Paris, trois employés excentriques enchaînent les mésaventures avec une imprécision chirurgicale.;;0;;Jamel Debbouze,Éric Judor,Ramzy Bedia,Catherine Benguigui,Sophie Mounicot,Jean-Luc Bideau;;Français,Sitcoms,Séries médicales,Séries comiques;;81088495,81294142,81580024,81275653,81218913,70143830,81600424,80235928,80073160,81625058,70136120,80124680,80993280,81290742,80171706,81587697,81010818,81191429,81212484,80014749,80191876,70153404,81567122,81520506,80194671,80987464,80094318,81043105,70281562;False;6
81273085;Seulement sur Netflix|Ajouts des 12 derniers mois|Ça devrait vous plaire|Les trouvailles du jour pour vous;Les chansons de Cocomelon;occ-0-2773-2774.1.nflxso.net/dnm/api/v6/6gmvu2hxdfnQ55LZZjyzYR4kzGk/AAAABTF9HOOAihXtyCWpMLctaHOjIYoxefWuSJlX_iq-96-McJGLX-6CSlhZ3mz1KkOKGrQj9Lw9cA1RlELjDqct87R64-0OnHDYG4cQvAgstfJKAF05AX8LJP9-IFbSXYwk0fpC.jpg?r=b04;2023;6 Saisons;;TOUS PUBLICS;Rejoignez JJ pour apprendre l'alphabet, les chiffres, les cris des animaux et bien plus dans cette série remplie de jolies comptines qui régaleront petits et grands.;;0;;;;Pour enfants,Grandir en musique,Éducatif jeunesse,Dessins animés;;81272431,80046348,81154166,81362788,70288470,80025494,80187223,81336334,81616116,70286901,81332264,81050106,81011059,81200689,81063145,81073764,60031264,81026605,81475311,80176872,81593310,80026226,81486556,70234499,81637392,80063705;True;4
81275653;Séries comiques|Séries nostalgie|Films et séries en français;Un gars, une fille;occ-0-2773-2774.1.nflxso.net/dnm/api/v6/6gmvu2hxdfnQ55LZZjyzYR4kzGk/AAAABXYUaYy6rziW3Oy3XWdUZsQHyc4PbHj__Pj2DU5CtP8OA7QRTUHX-itKJ8Bv4FD8V9mURWeN78NFZtYk0wY6T_xOBkIAfg1LBsg.webp?r=8ca;2002;5 Séries;Recommandé à 81 %;7+;Tâches ménagères, beaux-parents casse-pieds... Cette série humoristique en sketchs suit Jean et Alex, un couple de trentenaires, dans leur vie quotidienne.;;0;;Jean Dujardin,Alexandra Lamy;;Français,Sitcoms,Séries comiques;Décalé;81600435,81294142,70218756,70143830,80235928,80073160,81625058,81018383,81470399,80993280,80171706,81273360,81010818,81191429,81640438,80014749,70144327,80191876,70153404,80194671,81467328,81623358,80133335,70295080,81587696,70281562,81623360,81567123,81270678;False;3
81275686;Films et séries en français|Ajouts des 12 derniers mois|Téléréalité avec concours|Ça devrait vous plaire|Téléréalité|Seulement sur Netflix|Divertissement, variété et talk-shows|Les trouvailles du jour pour vous;Nouvelle École;occ-0-2773-2774.1.nflxso.net/dnm/api/v6/6gmvu2hxdfnQ55LZZjyzYR4kzGk/AAAABaUOl4fFRtf1cjmsFBvuv3zRQ-IPnb50CsdclTjdFfspENoasmXF8U7wEO_fVj-IjfXbl6ubXanwu9xpJlI6Bn9-54O3Y2BjesrQZi3EHV1K7frhyKOkMp8CtZ_n_zLngkxRqGZv5ike9YP75e7foXpwuYgVPe1bvZKD8_UghbMJYyN3Jg-jIQ9VnuctXfw-xtqpdSQUR2OuS1xJAnBxjwEOnMY02KcXktaWcnF3XaP9QcNLoJy4J9r0GWohlExBNM6qGKYhqhFX7sHy-bNqNwMQXgzMt_sVIKrl7fcSqFM3xOJ4_4cyMlo2vpic3MMD-rWeHEZFfRty5CJvSnFuSwaLR-hKSOwzp_yvCR5JbqIiyraRoSG-.jpg?r=678;2023;2 Saisons;;13+;De freestyles en battles, des rappeurs s'affrontent pour décrocher un prix de 100 000 euros, face à un jury composé de Niska, Shay et SCH.;;10;;Niska,Shay,SCH;;Musique,Français,Téléréalité avec concours,Culture Hip-hop,Téléréalité;;81426972,81196469,80141782,81032737,81029777,81497817,81521365,81423793,81313522,81631016,81026300,81127121,81285390,81276508,81031929,81046796,81423622,81417684,80223108,81024999,80160037,81044719,81075536,81057855,81447330,81587446,81490766,81519226,81598495,81310218,81436209;True;10
81277347;À regarder en un week-end|Films et séries en français;Mental;occ-0-2773-2774.1.nflxso.net/dnm/api/v6/6gmvu2hxdfnQ55LZZjyzYR4kzGk/AAAABcdHiT06KKuSuBq7Oe1o5_gyB3ygFwd2VDZBi4a1yWX9y4oRwuTVbp28wX-3-PkrhUbh_nvE4gnUdoF9w3IC0KvzmfO2Acpkt58.webp?r=617;2021;2 Saisons;Recommandé à 55 %;13+;Sincère, cynique et parfois tragique, cette comédie dramatique suit les péripéties de quatre adolescents lors de leur séjour en clinique pédopsychiatrique.;;0;Slimane-Baptiste Berhoun;Alicia Hava,Louis Peres,Lauréna Thellier,Constantin Vidal,Nicole Ferroni,Riad Gahmi,Léo Grêlé,Déborah Lukumuena;;Français,Séries pour ados,Séries comiques;;81273904,81600435,81030213,81463577,81342553,81190136,81423343,81290742,80198859,81303658,81233911,81191429,70140438,81625057,81640438,80117540,80171659,81428383,81623358,80133335,80115031,70295080,80241181,80176893,81623360,81270678,81018979;False;2
81277430;Blockbusters;Love and Monsters;occ-0-2773-2774.1.nflxso.net/dnm/api/v6/6gmvu2hxdfnQ55LZZjyzYR4kzGk/AAAABTSplzR_M5SnCNkdtibw7Ivck9TV-L-huDfJ21ST0phDEBmCGLlCLCujLFafsiTnVx6AYfRRQzPiISQmxf1jj4KPwwCZ-aal43djjs5owTtcByTbpn4auSPVwOnwz_8FGeEz.jpg?r=b6f;2021;1 h 49 min;;13+;Sept ans après avoir survécu à l'apocalypse et l'invasion de monstres, l'infortuné Joel quitte son confortable bunker souterrain pour retrouver son ex.;;0;Michael Matthews;Dylan O'Brien,Jessica Henwick,Michael Rooker,Dan Ewing,Ariana Greenblatt;Brian Duffield,Matthew Robinson;Films pour la famille,Films SF,Aventures en famille,Films comiques,Films pour ados;;81044417,81030627,80216309,80037476,81057361,80017529,81186049,70056430,81165134,81046394,80197462,81194641,81557402,81004278,80218306,80204465,70178621,80067831,80170280,60001650,81161789,81073022,80029196,80094318,80237937,70060015;True;1
81277950;Blockbusters|Films d'action et d'aventure|Films d'époque;Enola Holmes;occ-0-2773-2774.1.nflxso.net/dnm/api/v6/6gmvu2hxdfnQ55LZZjyzYR4kzGk/AAAABaAnduLnsJnnabkLA_oxBx-p9K35CEPinO8uZvXU5ccHkLmNC9fJqfE8k0mf2RN2zwu0eOqmVB3SZdh_HftjrAejJ89aKfXxuXzfSjoa6vKZdXw_nDecC4OCGsCfQtSYIwc2.jpg?r=74e;2020;2 h 4 min;;13+;Adolescente rebelle à la recherche de sa mère disparue, Enola Holmes utilise ses talents de détective pour surpasser son grand frère Sherlock et aider un lord en cavale.;;0;Harry Bradbeer;Millie Bobby Brown,Henry Cavill,Sam Claflin,Helena Bonham Carter,Louis Partridge,Burn Gorman,Adeel Akhtar,Susan Wokoma,Frances de la Tour,Fiona Shaw;Jack Thorne;Films pour la famille,Drames pour la famille,Aventures en famille,Drames,Intrigues;Suspense;81410649,80994082,80017529,80241581,70195800,70305903,81349306,80169498,81414644,81476441,80050008,81222923,81210762,80234304,80136311,70213223,80057918,70155618,81472752,81078393,80119411,81140933,80244781,81043665,445386,80176893,81059939,80189685;True;3
81279312;Mondes épiques|Séries d'action et d'aventure;The Witcher : L'héritage du sang;occ-0-2773-2774.1.nflxso.net/dnm/api/v6/6gmvu2hxdfnQ55LZZjyzYR4kzGk/AAAABcJ6vxe2xiPV175bck7isz3YBL0Jr9NSprW1I7e6SPbCMO0BbFjBads96H2rv2Ej3e0rlsu7nI_lwgaYp9KmmVvQVBCqgs3PZ26mJyIJGXKEZhRJwGVko8JPV6tV5hb7Zu41.jpg?r=e89;2022;Mini-série;Recommandé à 55 %;16+;"Plus de mille ans avant les événements se déroulant dans ""The Witcher"", sept guerriers bannis du monde elfique unissent leurs forces contre un empire tout-puissant.";violence;0;;Sophia Brown,Laurence O'Fuarain,Michelle Yeoh,Mirren Mack,Lenny Henry,Jacob Collins Levy,Lizzie Annis,Huw Novelli,Francesca Mills,Amy Murray,Nathaniel Curtis,Zach Wyatt,Dylan Moran,Minnie Driver;;Séries inspirées de livres,Séries d'action et d'aventure,Séries US,Séries fantastiques;;70119441,80230293,80242724,80182016,81067756;True;2
81279324;Films d'action et d'aventure;Sniper: Assassin's End;occ-0-2773-2774.1.nflxso.net/dnm/api/v6/6gmvu2hxdfnQ55LZZjyzYR4kzGk/AAAABdmXeFGLMgvo_vpWsau5Qu32ICv6L8uNGQ7HUa_z9rR9P2MMvv-uHYCV1M8v-nAUAL2LQzQshTCU9BuUg0qz315T5EvCeWERSIM.webp?r=e87;2020;1 h 35 min;Recommandé à 55 %;16+;Cible d'un complot l'accusant d'un meurtre qu'il n'a pas commis, un sniper des forces spéciales fait appel à son père, tireur d'élite réputé, pour trouver le vrai tueur.;violence;0;Kaare Andrews;Chad Michael Collins,Sayaka Akimoto,Tom Berenger,Ryan Robbins,Lochlyn Munro,Emily Tennant,Michael Jonsson,Vincent Gale;Oliver Thompson;Films d'action;Violent;80216309,81612863,81481808,70056430,81161372,81396545,60026139,70020509,81557402,81458368,81370440,80067831,81388316,81486213,80071227,70208104,70281312,80013871,81073022,80098202,80240371,80133543,81198448,80237937,80113647,81249833;False;1
81280035;Blockbusters|Films d'action et d'aventure;Luther : Soleil déchu;occ-0-2773-2774.1.nflxso.net/dnm/api/v6/6gmvu2hxdfnQ55LZZjyzYR4kzGk/AAAABbSNwEZTeB_xWicf1BZrCd3W1dQgwhSmQthKi5d0c14W708Sl-hk2BpCUR4VLCAl6YOwxPpyX1eV67c0R4y-x4-YbPpKfdgpiSj2JZlz2qydt6uVfL3EG9gcpJjISuSia4RB.jpg?r=9e5;2023;2 h 10 min;;16+;Hanté par un meurtre non résolu, John Luther, brillant policier londonien en disgrâce, s'évade de prison pour traquer un sinistre tueur en série.;violence, suicide;0;Jamie Payne;Idris Elba,Cynthia Erivo,Andy Serkis,Dermot Crowley,Thomas Coombes,Hattie Morahan,Lauryn Ajufo,Vincent Regan;Neil Cross;Films policiers,Intrigues,Policiers d'action,Films d'action;Sombre,Suspense;60011663,70079583,80994082,81135138,81260280,81161372,80200961,81600424,81279324,70020509,81212842,81457437,81576814,81152992,80236390,81317562,81460361,80013871,81073022,70305892,80236319,80241181,80207506,81198448,60026139,81160697,81478985,81249833;True;2
81280792;Ajouts des 12 derniers mois|Ça devrait vous plaire;LEGO Ninjago;occ-0-2773-2774.1.nflxso.net/dnm/api/v6/6gmvu2hxdfnQ55LZZjyzYR4kzGk/AAAABXx5mj2_Af4fUrJaMX3rNjyo7lzDwE6J_JXVcmvXDweMGlCFGmmMn7CDFGT2wYtIMAUEKckBu0DKaYiYsGM-5F0DXPxo84vJRJY.webp?r=89c;2022;6 Saisons;Recommandé à 92 %;7+;À Ninjago City et dans d'autres contrées, les ninjas combattent leurs ennemis, mènent de nouvelles quêtes et nouent des alliances qui menacent parfois leur amitié.;;0;;Michael Adamthwaite,Paul Dobson,Kelly Metzger,Brent Miller,Kirby Morrow,Pauline Newstone,Vincent Tong,Sam Vincent;;Pour enfants,Canadien,Dessins animés;;81223075,80075820,81121910,80225085,70177689,81628818,81670673,80062112,80075595,81616116,80003196,81280732,80103408,60031264,80155771,81291575,80176076,70142405,81026605,81475311,81193140,81354663,81068803,81186971,80212245,81093076,80039394;False;2
81280926;Pour se détendre;Le guide Headspace de la méditation;occ-0-2773-2774.1.nflxso.net/dnm/api/v6/6gmvu2hxdfnQ55LZZjyzYR4kzGk/AAAABdmF1UzY5ULTxtNvl3RXmcch9gxogPu5U_oJWmlQxnwkDsKUzKPXr1swd-KAbljofJl7cMJ6lr9ogiSGXRlkwKhH7oKYQMXDhVyXii9LBEykCa1LgIRhgpUZO4vnUqOnSX2A.jpg?r=c79;2021;8 Épisodes;;TOUS PUBLICS;Headspace jette un regard sympathique et animé sur les bénéfices de la méditation, et propose des exercices guidés et des techniques pour s'y mettre rapidement.;;0;;Andy Puddicombe;;Émissions sciences et nature,Thématique,Docus sciences et nature,Séries documentaires,Séries US;;80231917,80216752,81273453,80209895,81609455,81098586,81470648,81010166,81031737,81343342,81345769,80215997,81469908,81254224,80229847,81409016,81183477,81074662,81116168,81312877,81157840,81387962,80102204,81447086;True;1
81281579;Anime;Valkyrie Apocalypse;occ-0-2773-2774.1.nflxso.net/dnm/api/v6/6gmvu2hxdfnQ55LZZjyzYR4kzGk/AAAABUPKWi5hI1UeVY6AMerLgG_NJrY5p0IkOh4HHs6PD4iPeXHxAqWkmQOpQEqOpoKX-98OrHYSTaTlBN8IJEJDjB2dXs-t3_8YPt3ks6OMLfS6rLs0QMOS013SSg6HJU8efzgj.jpg?r=49a;2023;2 Saisons;;16+;Avant d'éradiquer l'humanité, les dieux décident d'accorder une dernière chance aux Hommes de prouver ce qu'ils valent. Que les combats du Ragnarok commencent !;violence;0;;Miyuki Sawashiro,Tomoyo Kurosawa,Tomokazu Seki,Soma Saito,Kazuhiro Yamaji,Hikaru Midorikawa,Wataru Takagi,Takahiro Sakurai,Junichi Suwabe,Yukihiro Nozuyama,Hinata Tadokoro,Taisuke Nakano,Tomohiro Yamaguchi,Tatsuhisa Suzuki,Rie Tanaka,Yoshitsugu Matsuoka,Sho Hayami;;Anime SF et fantastique,Anime d'action,Japonais,Séries d'animation japonaise,Séries inspirées de mangas;;81239555,80023687,81295011,81054853,81302750,81236338,81001988,80179831,80045948,81091393,80992228,81043571,70300472,80200989,80095241,81261669,80995578,81116060,81177634,80191008,80204451,80050063,81002441,70299043,81281582,81249833;True;1
81283608;Inspiré de crimes réels;42 jours d'obscurité;occ-0-2773-2774.1.nflxso.net/dnm/api/v6/6gmvu2hxdfnQ55LZZjyzYR4kzGk/AAAABaYkM9nOlo4O0DKELNdBhNL0ODE7Rq96Ob60K1uVdvFAaT9kisRBXQ7WA5KwqBVvF6gwX-d3u5Z8yd55BhK71fcvhs4k9zN7A3QPCNc5MdJKgJyyQRsnSxTfMtkMXibqh_Zt.jpg?r=962;2022;6 Épisodes;;13+;Dans une ville du Chili, une femme recherche frénétiquement sa sœur disparue sur fond de tempête médiatique et d'enquête policière. Inspiré de faits réels.;;0;Gaspar Antillo,Claudia Huaiquimilla;Claudia Di Girólamo,Pablo Macaya,Daniel Alcaíno,Aline Küppenheim,Julia Lübbert,Monserrat Lira,Amparo Noguera,Néstor Cantillana,Claudio Arredondo,Daniela Pino,Gloria Münchmeyer;;Séries dramatiques,Chilien,Séries inspirées de livres,Séries d'intrigue,Séries policières;Cérébral,Sombre;80200549,81453541,81033361,81463577,81015514,80240691,81396545,80173623,80114855,81335264,80117555,81346087,80241855,81318108,81039388,81417796,81641220,81108061,80175802,81478537,81045829,81605880,80241181,81150793,81303831,81612863;True;1
81284981;Seulement sur Netflix|Divertissement, variété et talk-shows|Téléréalité|Téléréalité avec concours;Love Is Blind : Brésil;occ-0-2773-2774.1.nflxso.net/dnm/api/v6/6gmvu2hxdfnQ55LZZjyzYR4kzGk/AAAABfhoIahatV-VzFwsxBwZg8DaMKQAI_rxdA8v5_fJVAamvWfRZTixMsMIm_eJgQUBGbL7A1t-As7yUWmU3V13a2ybTjf8Xi-6xnhZ8PD6TWAoamRc7qXNEDPMZRp4dcoUWaGY-WUXCkLwHpnsuWKS9hofZWgcdid1OLwSlN0Cwq2x_rzlJcQ17gp0KeOlW7HCv7-Bl_2KnrCfpZ7I-ylnwPLjgxbUPCdJcN6Wo8TVljWF3EZ5vUTqYxvdfKfs3243gTZKCz8la7hHDce7tmzww-fk2-TboxHxwe72os6q6P-MxpCHTSc7nYfCFg.jpg?r=ba0;2023;3 Saisons;;13+;L'expérience de rencontre est transposée au Brésil, où des célibataires recherchent le grand amour et se fiancent, sans jamais s'être rencontrés en personne.;;5;;Camila Queiroz,Klebber Toledo;;Brésilien,Téléréalité avec concours,Téléréalité romance et mariage,Téléréalité;Romantique;81350804,81292203,81417598,80244565,81032737,81462121,81521365,81436209,81456532,81307101,81423793,81474612,81394999,81026300,81127121,81347577,81504299,81642255,81417684,81444148,81075536,81310218,81218438,81582706,80204889;True;5
