ID;categorie;titres;liens_images;année;durée;score_recommendation;age_conseillé;description;prévention;mise_en_avant_supplémentaire;réalisation;distribution;scénariste;genres;avertissement_programme;recommendations;netflix_original;nombre_occurrence
80240585;Séries d'action et d'aventure;Agent Elvis;occ-0-2773-2774.1.nflxso.net/dnm/api/v6/6gmvu2hxdfnQ55LZZjyzYR4kzGk/AAAABUIohJ45ouO-Q1nFzU4BGJatY55ATfrFK3kH-RF0mwyPyJS5ubhq6Uo78qlqB3d56iFtWoqwC2T7lZaVxHu2xDdbyfpfpTFLsSPBNQw0lH79kuU2fvSVoMGx8UXSk_Ps3xRT.jpg?r=d6e;2023;10 Épisodes;;16+;Dans cette comédie d'animation pour adultes, Elvis troque ses habits de scène pour un réacteur dorsal et rejoint un programme d'espionnage secret pour combattre les forces du mal.;violence, drogue;0;;Matthew McConaughey,Kaitlin Olson,Don Cheadle,Johnny Knoxville,Niecy Nash-Betts,Tom Kenny;;Séries comiques,Séries d'action et d'aventure,Séries US;Insolite,Violent;81008138,81053303,81304528,81030627,80001305,80987903,81080959,70143830,70136120,81092963,81214194,80241499,80995819,80189631,81259476,80014749,70153404,80169469,80235932,81297404,70171942,80174479,70155589,81067223,70281562,81249833;True;1
80241001;Thrillers TV|Séries policières|Séries à regarder sans modération;Permis de vivre;occ-0-2773-2774.1.nflxso.net/dnm/api/v6/6gmvu2hxdfnQ55LZZjyzYR4kzGk/AAAABaeXMzbAZNp8vfuh6uJKznABS8Zbf908lrW7BdH7rKQeOMu8Vs3Oyv8joZmcxUbyYPt12bDRh0FdOXywmcf9dMBOrO60duU47qaprDTVXWznN_KV7LInPs5Nu-b3hP5r0x1L.jpg?r=0a8;2020;2 Saisons;Recommandé à 88 %;16+;Quand un baron de la drogue galicien cachant son Alzheimer annonce qu'il prend sa retraite, son second complote pour court-circuiter l'héritier et s'emparer de l'empire.;violence, drogue;0;;Jose Coronado,Álex González,Claudia Traisac,Luis Zahera,Pilar Castro,Giulia Charm,Leonor Watling,Patrick Criado,Édgar Vittorino,Unax Ugalde,Ledicia Sola,Xabier Deive,Camila Bossa,María Guinea,Javier Abad,Mercedes Castro,Paula Morado,Paula Pier,Carmela Martins,Denis Gómez,Miguel Borines,Ana Villagrasa,Xavier Estévez,Carlos Hipólito,Àlex Monner,Ricardo Gómez,Daniel Currás,María Vázquez;;Espagnol,Séries inspirées de livres,Séries policières,Thrillers TV;Émotion;81388035,81612863,81481808,81033361,81036936,81104482,80241387,81603987,81494917,80211572,81317562,81149763,81166747,81478537,80176893,80207506,80241181,80167647,80107369;True;3
80241027;Pour se détendre|Séries US|Téléréalité|Téléréalité avec concours|Divertissement, variété et talk-shows;Séduction haute tension;occ-0-2773-2774.1.nflxso.net/dnm/api/v6/6gmvu2hxdfnQ55LZZjyzYR4kzGk/AAAABczqszI7IxfXc85QSP5U6kjKwdmp8OZ56a6yZ7-4gttO10I1M88pL-valm21p1_Ll-64Nu43o5gnwvMK8BUXRkLFtWM6Et9z37nWPW-0lExqQW16a1SqGBxtbbgZMXPaB7Gc.jpg?r=293;2022;4 Saisons;Recommandé à 80 %;13+;Aux portes du paradis, de séduisants célibataires se tournent autour, mais il y a un mais. Pour remporter une coquette somme, ils doivent rester chastes !;;7;;Desiree Burch;;Téléréalité avec concours,Téléréalité,Séries US;Torride,Intimiste;81196469,81032737,81341222,81462121,81497817,81521365,81436209,81307101,81474612,81394999,81417726,81127121,81026300,81347577,81642255,81417684,80160037,81220971,81075536,80216665,81310218,81582706,80204889;True;7
80241181;Séries dramatiques|Ça devrait vous plaire|Pour se détendre|Séries US|Les trouvailles du jour pour vous;New Amsterdam;occ-0-2773-2774.1.nflxso.net/dnm/api/v6/6gmvu2hxdfnQ55LZZjyzYR4kzGk/AAAABXZ09Z8CsQCIrhmzu_vTagIDQSFkjONp5t3BxCdd9WX3qWDBwOfz0JB7W9Znix9AZHG7eB1aAnF9hud9n4VnXw3mxCIoicH_hrh3ynhTVCW32wbRj8NijlGlIXZHI3vn01zfATB9OpvV2Fd8shH-jvbG6mXcspa2qtVjZHx96hF4sUR9eS6siD8GEYWy9hpqO9kABPeXIUjxcANeYKUNx0oA19dYjQ80OpxoZhRDR3HlcPjfbziY3wuX7x9ioF7aBZAHUPFPNlpKMSEBCBOGfzvMbhasJ94ovlbvrkplxlqeMm_NiD8lai3oaP_FebI83Imr_wYEJ8hHk61z1aaQtHuC.webp?r=439;2021;3 Saisons;Nouveau;16+;L'un des plus anciens hôpitaux des États-Unis accueille un nouveau directeur, le docteur Max Goodwin, bien décidé à changer les choses et sauver des vies.;;8;;Ryan Eggold,Freema Agyeman,Janet Montgomery,Jocko Sims,Anupam Kher,Tyler Labine,Alejandro Hernandez,Sandra Mae Frank,Debra Monk;;Séries médicales,Séries dramatiques,Séries inspirées de livres,Séries US,Séries dramatiques sociales;Émotion;81417638,81435370,81459281,81581068,80202258,80197327,70195800,80111425,81140282,80111373,80239866,81609511,70114497,81603987,80024057,80057918,70155618,70281312,80196149,81140933,80240027,81166770,80176893,80207506,80113647,81612863;False;8
80241239;Ajouts des 12 derniers mois|Mondes épiques|Films et séries jeunesse|Séries d'action et d'aventure|Seulement sur Netflix;Locke & Key;occ-0-2773-2774.1.nflxso.net/dnm/api/v6/6gmvu2hxdfnQ55LZZjyzYR4kzGk/AAAABSkPFDfjiQ9p3nh3-SS9XpWr04kX0_Bv9Dg0lC5h0EpwxTn0x5YOtHERwFuAhtKYTT_IV1eWNqWAf6TAYzjh4FJ6eDcx1Wi6IcnbyvJ4CUVdxEuGGZhi_7sw8djSOtFkCjvy.jpg?r=968;2022;3 Saisons;;16+;Après le meurtre de leur père, trois enfants emménagent avec leur mère dans une maison de famille où ils découvrent des clés magiques aux pouvoirs extraordinaires.;violence, drogue;0;;Darby Stanchfield,Connor Jessup,Emilia Jones,Jackson Robert Scott,Petrice Jones,Laysla De Oliveira,Griffin Gluck,Aaron Ashmore,Brendan Hines,Hallea Jones,Sherri Saum,Kevin Durand,Bill Heck,Genevieve Kang,Coby Bird,Kevin Alves,Thomas Mitchell Barnet,Eric Graise,Felix Mallard,Martin Roach,Asha Bromfield,Steven Williams,Jesse Camacho,Joy Tanner,Liyou Abere;;Séries pour ados,Séries d'action et d'aventure,Séries US,Séries fantastiques;À énigmes;81335124,81002270,80232926,80242724,81156676,80084447,80241581,81279312,70283264,80992263,80221644,80050008,80223989,81258637,80218885,81213653,81150303,80057918,80220679,80104198,80238357,80176219,81140933,81220825,80199393,81116060,80133543,80236319,80241181,80176893,81249833,80189685;True;6
80241318;Séries SF et fantastique|Séries à regarder sans modération|Ajouts des 12 derniers mois|Séries de SF et d'horreur|Ça devrait vous plaire|Séries US|Seulement sur Netflix|Les trouvailles du jour pour vous;Manifest;occ-0-2773-2774.1.nflxso.net/dnm/api/v6/6gmvu2hxdfnQ55LZZjyzYR4kzGk/AAAABWBRdLkOuhPhvwy5F0vWmNeV63U35u4wjmCOO18nVYn-518dROyY15aHNdaKKKRytuG5Q6zQ-x7NPXm-fK8_6QKjJevJvPEn1olfyptFeH4lI_s_wu90U2gUPL-DWdhdgom4Bl8z11ZHGtjVBHTySeVJQT-iuPxMjRbWNNOHwJUQynIdRrxn_iwvlsUWf41w08LkYrPibXDiLfXLFRmE8m7RSjVZbRWHsbRFwa6hw9x90r58Dk0cy39v6HtLkhaDeNzFFlYYFSw_j-1VCM5cGR6AgpAkkQH79-aLP1d6CjkrC6hMqEQlbEkMyR2LZdjO9Hcf8MAfgAEpjqTSN22n3HKU4EgWiWsQONL6kX9ySsTXJOHr83o05bwY.jpg?r=3ca;2022;4 Saisons;;13+;Quand un avion atterrit mystérieusement des années après son décollage, les passagers découvrent l'étrange nouvelle réalité d'un monde qui a continué d'avancer sans eux.;;9;;Melissa Roxburgh,Josh Dallas,J.R. Ramirez,Athena Karkanis,Luna Blaise,Jack Messina,Parveen Kaur,Matt Long,Holly Taylor,Daryl Edwards,Ty Doran;;Séries SF,Séries d'intrigue,Séries US;À énigmes,Suspense;80214497,81459281,81581068,81397077,80025744,70305903,70283264,81258637,81557402,81495803,80210920,80100172,81603987,80212986,80024057,81406219,81276119,80105699,81476183,81008221,70281312,80198988,80154610,80196149,81233755,80177458,81304948,80241181,80207506,81580045,80176893,80113647,81612863;True;9
80242619;Blockbusters;Murder Mystery;occ-0-2773-2774.1.nflxso.net/dnm/api/v6/6gmvu2hxdfnQ55LZZjyzYR4kzGk/AAAABeyxcbh_CKut2QpIvks5Y_MZjeUDxvjyI5RixXFUYK-_flVOXVbQJbWWo2wKBscEFF8UmAg57NN5pYAXo4btlPFFRbgd0RaN3ow1nzpbdxnzXXlq03VPTuzYljesGLbC37cK.jpg?r=f16;2019;1 h 38 min;;13+;Lors d'un voyage tant attendu en Europe, un policier new-yorkais et sa femme se démènent pour résoudre un meurtre inexplicable survenu à bord du yacht d'un milliardaire.;;0;Kyle Newacheck;Adam Sandler,Jennifer Aniston,Luke Evans,Gemma Arterton,Adeel Akhtar,Luis Gerardo Méndez,Dany Boon,Terence Stamp;James Vanderbilt;Films comiques,Intrigues,Films d'action;Décalé;70041162,81030627,80037476,80245104,80242342,80183328,70267242,70220030,81165134,81033865,81458416,81018383,81251628,80063265,70208247,81161828,81152992,70153404,70087541,80158583,70270408,70125231,70113002,70021637,80094318,80039517;True;2
80242724;Mondes épiques|Séries d'action et d'aventure;Warrior Nun;occ-0-2773-2774.1.nflxso.net/dnm/api/v6/6gmvu2hxdfnQ55LZZjyzYR4kzGk/AAAABdCvP_R_Bq2yS3zW2ehwwmyKvHxs-Ud-IKJRxbouyviZH4_ObBEPRCejN3iG2y0j-OGbUEwIdXzibWBML2vc1477iZibqk14oAsLEbdxYtmC6cxncR2sbLlubR_eNSHUhxpe.jpg?r=763;2022;2 Saisons;Recommandé à 71 %;16+;Une ado orpheline se réveille à la morgue et découvre ses nouveaux superpouvoirs : elle est porteuse du Halo d'une société secrète de religieuses chasseuses de démons.;violence;0;;Alba Baptista,Thekla Reuten,Lorena Andrea,Toya Turner,Kristina Tonteri-Young,Tristán Ulloa,Sylvia De Fanti,William Miller;;Séries pour ados,Séries d'action et d'aventure,Séries US,Séries fantastiques,Séries inspirées de B.D.;Suspense;81582615,81030627,81252707,80186863,70056430,80230293,81165134,80189829,70283264,80221644,80097140,81458368,81213653,80218200,80244780,80170280,80027042,80238357,80121349,80133543,80117803,81249833;True;2
80243876;Anime;ベルセルク;occ-0-2773-2774.1.nflxso.net/dnm/api/v6/6gmvu2hxdfnQ55LZZjyzYR4kzGk/AAAABTCg0834_eedr95PVwcG1Xrug5J6FGXr5P7oy3Bab6VqIBTmnJ43Ii-2q9DXl7HhKe-S4OAnFDnthkXA9f8RVtXehffUkKwOCzc.webp?r=9fb;1997;25 Épisodes;;18+;Au cœur d'un univers médiéval, un mercenaire errant rejoint un chef charismatique dans sa quête impitoyable de gloire et de reconnaissance.;violence, violence sexuelle;0;;Nobutoshi Canna,Toshiyuki Morikawa,Yuko Miyamura,Akira Ishida,Tomohiro Nishimura,Akiko Yajima,Masuo Amada,Yuri Shiratori,Tessho Genda,Tamio Oki,Masahito Kawanago,Mahito Tsujimura,Toru Okawa,Toshiko Sawada,Naoki Bando,Minoru Inaba;;Anime SF et fantastique,Anime d'action,Japonais,Séries d'animation japonaise,Séries inspirées de mangas;Violent;80001305,81499847,81295011,81302750,80179831,81091393,70204964,81183924,81050064,80992228,70300472,80200989,81261669,80995578,70308852,80174608,81409869,81033445,60021103,80146298,81177634,80191008,80174974,70299043,81281582,81249833;False;1
80244565;Divertissement, variété et talk-shows|Téléréalité;Indian Matchmaking;occ-0-2773-2774.1.nflxso.net/dnm/api/v6/6gmvu2hxdfnQ55LZZjyzYR4kzGk/AAAABcmJR-YjcBoyRBiEGh9fHptM3bNThdO703qWrD4qzp_O-VmYLbvKAbCd7Xq10dZLQmuUZ6Bc9_LT1SHdRzMucp0MtvMMl0px_fTY7qHoT5uP3lKFrTKn8Tc6Ny1-faXcxN4y.jpg?r=d9a;2023;3 Saisons;Recommandé à 55 %;7+;La marieuse Sima Taparia aide ses clients du monde entier à arranger leur mariage, conformément à une tradition qui prend aujourd'hui de nouvelles formes.;;0;;;;Téléréalité romance et mariage,Téléréalité,Séries US;Intimiste;81417598,81411891,81462121,81014405,70234677,81456532,81505384,81512574,81127121,80993568,81180964,81109061,70217931,81161576,81417684,81175724,81447330,81039144,81480322,81338328,80204889,81292203;True;2
80244630;Thrillers TV;Mon amie Adèle;occ-0-2773-2774.1.nflxso.net/dnm/api/v6/6gmvu2hxdfnQ55LZZjyzYR4kzGk/AAAABbsbtBm_b_4qG8YaZvuy_724S_B_xILS8nZalfL_kIa8iGXPETnHNKKdrO1toB5l8J2pBgswbNg32DtpS7pLUek3p7Nxr2NMVL91FdfSnKU6qoivn2Hup5F7igyjgYAjWjOX.jpg?r=6f2;2021;Mini-série;;16+;Une mère célibataire est prise dans un jeu de manipulation après avoir entamé une liaison avec son patron, un psychiatre, et s'être rapprochée de sa mystérieuse épouse.;drogue;0;;Simona Brown,Eve Hewson,Tom Bateman,Robert Aramayo,Tyler Howitt,Georgie Glen;;Britannique,Séries inspirées de livres,Séries d'intrigue,Thrillers TV;À énigmes,Suspense;81029704,81388035,81481808,81033361,81463577,81015514,81239598,81036936,81001209,81346087,81349458,81494917,80991754,81417796,80185171,80213445,81045829,80241181,80207506,80176893,81150793,81612863;True;1
80244780;Mondes épiques;Luna Nera;occ-0-2773-2774.1.nflxso.net/dnm/api/v6/6gmvu2hxdfnQ55LZZjyzYR4kzGk/AAAABSs3GkLDlBW_rltD_ClCBsb60o_3Ppjh6oF8ij9jWXna5EGafvyJF0Mj8ljGi-2umzE8fE7Jij3brBi7KPauNfFyFKonIeT-3bW8pK2TyDO9V5zEI-C2Q3jS1Z7rWo7cyR9K.jpg?r=25f;2020;6 Épisodes;;16+;Dans l'Italie du XVIIe siècle, une adolescente découvre sa destinée au sein d'une communauté persécutée, alors que le père de son petit ami la traque pour sorcellerie.;;0;;Antonia Fotaras,Giorgio Belli,Manuela Mandracchia,Roberto De Francesco,Federica Fracassi,Lucrezia Guidone,Adalgisa Manfrida,Giada Gagliardi,Giandomenico Cupaiuolo,Gloria Carovana,Filippo Scotti;;Italien,Séries inspirées de livres,Séries pour ados,Films d'époque,Thrillers TV;Émotion,Romantique;;True;1
80244928;À regarder en un week-end;The English Game;occ-0-2773-2774.1.nflxso.net/dnm/api/v6/6gmvu2hxdfnQ55LZZjyzYR4kzGk/AAAABeiKEcC0EQs4O08luRcU-ii4_E-kcmXGa2lpcfOqvKHR9WxtpzNs9aHAqCNcSbNi953ws09nsOMmkCFaFY7C2qE0UPb53v6r9AtWR3mv1PiyHj1biq3ROxEWf42q3_A55g7f.jpg?r=144;2020;6 Épisodes;;13+;Au 19e siècle, deux footballeurs de classes sociales différentes bravant les défis professionnels et personnels vont changer le sport, et l'Angleterre, à jamais.;;0;;Edward Holcroft,Kevin Guthrie,Charlotte Hope,Niamh Walsh,Craig Parkinson,James Harkness,Ben Batt,Gerard Kearns,Henry Lloyd-Hughes;;Séries dramatiques,Britannique,Films d'époque,Séries inspirées de faits réels,Séries dramatiques sociales;;81410649,60011152,81167887,81002196,81564749,81249469,70135893,81267689,70213223,80213020,80182016,80161728,80074781,80119411,81140933,80241181,80176893,81211064,81473474,81426931,80070050;True;1
80245353;Téléréalité avec concours;Basketball or Nothing;occ-0-2773-2774.1.nflxso.net/dnm/api/v6/6gmvu2hxdfnQ55LZZjyzYR4kzGk/AAAABVTfMFDw8Xe86Ao-XAVz4JlSDblWtMwzboBcXQyoGS8mQKC07Dqypc2dCsKBxDv33_3TmmHYHtvOKk89gpX_c4NgRkhltprX15peI0IHrXRUXHvbKZTxSV5Uv_4l18uJCPVG.jpg?r=19d;2019;6 Épisodes;;7+;Suivez l'équipe de basket du lycée de Chinle en quête d'une victoire au championnat de l'Arizona pour la plus grande fierté de la communauté navajo.;;0;;;;Téléréalité avec concours,Téléréalité,Séries documentaires,Séries US;;81274937,81074673,81426972,81043583,80142615,81452996,81139973,81084829,81505384,81480089,80202829,81386989,81644531,80049873,81025735,80227160,81026440,81026439,81026443,81580687,80157137,81396409,80164752,80244479,80198306,80187722;True;1
80986854;Pour se détendre;I Think You Should Leave with Tim Robinson;occ-0-2773-2774.1.nflxso.net/dnm/api/v6/6gmvu2hxdfnQ55LZZjyzYR4kzGk/AAAABe0fIrK8zc-RA7r_mWH9bqWGW9uFggIm3cpy2sXnaEpRKucyDx8qjbGlTFnOUFyzIsQF8yVCIxo-Jd2H7TlEgK2Co9-cNpAxMbrv1FoP2x_0iH2fW0NQXNZw57pCvWlH5eR0qZxq4_phZsa5yGYqwTjIbnWkHNEdy2hRd6jERFftAHRIKveeCuxC0KuQm03nWkPuU1IfWML8NPShsk47q8VHDi4lvMg_QXXR2SQ0H6w-L_2LXioJkKbNzus648wQcVy44euu0Hjq08WagDKKKrUWUW3t9StEJHovb6R9-9MhdQ2Dfbj7dkj5hA.jpg?r=aa7;2023;3 Saisons;;16+;Cette série comique à sketchs présente une liste impressionnante de guest-stars dans un festival de situations décalées.;;1;;Tim Robinson,Andy Samberg,Sam Richardson,Will Forte,Fred Willard,Cecily Strong,Tim Heidecker,Kate Berlant,Patti Harrison,Conner O'Malley;;Séries comiques,Séries US;Absurde,Insolite;70300800,70153373,81516751,81581068,81619082,70218756,81343300,70143830,81087498,80243600,70136120,70140358,81009617,81214194,80073289,81447461,80014749,70153404,70270408,81193104,70171942,80198950,80113701,70155589,80049065,70281562;True;1
80986885;Inspiré de crimes réels;Operation Finale;occ-0-2773-2774.1.nflxso.net/dnm/api/v6/6gmvu2hxdfnQ55LZZjyzYR4kzGk/AAAABdOkaUb8_ckbTZIBueUhbL79Kf0wNuGFE1nD3w8nTjXBwp-B-9GgUJqWfzurh_sUkbpmQCBbE0fMxe_4CwI4cexn9-gilRPUmgQCIpLqXfb5CY7X3aFu2EjPu9akFLGDMxgI.jpg?r=682;2018;2 h 3 min;;16+;En 1960, des espions israéliens se lancent dans une périlleuse mission pour capturer un nazi notoire et traduire ce criminel de guerre en justice. Inspiré de faits réels.;violence;0;Chris Weitz;Oscar Isaac,Ben Kingsley,Lior Raz,Mélanie Laurent,Nick Kroll,Joe Alwyn,Haley Lu Richardson,Michael Aronov,Peter Strauss,Ohad Knoller,Torben Liebrecht,Greta Scacchi,Pêpê Rapazote;Matthew Orton;Thrillers,Films inspirés de faits réels,Films d'espionnage,Drames sociaux;Cérébral,Suspense;60011663,80041653,80146804,81221170,80017529,70056430,80170278,81161372,81144852,81140931,70266110,80244019,70305907,81186240,80240537,81248111,81320168,81166791,80191608,81166149,70208104,80106138,80013871,80098202,80188120,80207506;True;1
80987077;Séries policières;Signal;occ-0-2773-2774.1.nflxso.net/dnm/api/v6/6gmvu2hxdfnQ55LZZjyzYR4kzGk/AAAABVD1BlAkpA__pPVL1PdInaRY8_hmdbu6CXYikOLNj57wSL9JxuTzKTeooBjtdrMaPzPLkDhB08KFS22KfPsZwN57lz9LbSj7yZU.webp?r=bc8;2016;16 Épisodes;;16+;Communiquant à l'aide d'un talkie-walkie qui se joue du temps, un criminologue de 2015 et un inspecteur de 1989 font équipe pour combattre le crime et l'injustice.;violence sexuelle;0;;Kim Hye-soo,Lee Je-hoon,Cho Jin-woong,Jang Hyun-sung,Cheong Hae-kyun,Kim Won-hae,Jung Han-bi,Lee Yu-jun,Son Hyun-joo;;Coréen,Séries policières,Thrillers TV;Sombre,Suspense;80990668,81628920,81672245,81482636,81437733,81640988,81503026,80987095,81305432,81552615,81061735,81413647,81482654,81280917,81556894,80990381,81357268,81357304,80187302,81177545,81323914,81594875,81671939,81577271,81482512,80998941;False;1
80989772;Documentaires;Le Parcours des tyrans;occ-0-2773-2774.1.nflxso.net/dnm/api/v6/6gmvu2hxdfnQ55LZZjyzYR4kzGk/AAAABVs9B_Kl17nUxZWGLXVAlIWZ-3NrH2WSNI_AKz3TeZbpdPmj6DyX1oLkMNAEAW8GcnygSrYbAMwAEvg2822i0Mrohwc4OyIvXwYRsRTIxwn994y3m7h7dzc_bdHuUjbuUyCj.jpg?r=8e5;2021;6 Épisodes;;16+;Pour diriger d'une main de fer, tout aspirant dictateur doit suivre l'exemple des despotes présentés dans ce docu-série et appliquer le guide du pouvoir totalitaire.;violence, images choquantes;0;;Peter Dinklage;;Séries politiques,Documentaires politiques,Documentaires sur l'armée,Séries documentaires,Séries US;Sombre;80216752,80109535,81273453,81064069,81098586,80106791,81018709,80134093,81493626,81264660,81316863,80138915,80211648,81469002,81315804,81014547,81013210,80208211,81116168,81035118,81227142,80237990,80208082,21477429,81467138,80989924;True;1
80989924;À regarder en un week-end|Documentaires|Films et séries du Royaume-Uni;Les grandes dates de la Seconde Guerre mondiale en couleur;occ-0-2773-2774.1.nflxso.net/dnm/api/v6/6gmvu2hxdfnQ55LZZjyzYR4kzGk/AAAABU1duBxeSRimtCI5qQ0iuusTjBH54M3gxfodlsHGtwPQJP1E4oLZMm2fFLt_x2DwSaNTP72wQqIv4m8Y6bH3-5oushkT9bkOnsQ.webp?r=62e;2019;10 Épisodes;Recommandé à 55 %;13+;De Pearl Harbor au débarquement, les événements les plus cruciaux de la Seconde Guerre mondiale prennent vie dans ce docu-série frappant présentant des images colorisées.;;0;;;;Séries politiques,Britannique,Documentaires historiques,Documentaires politiques,Documentaires sur l'armée;;80169786,80133922,80106791,81018709,80134093,81493626,81264660,81582696,81316863,80138915,81469002,81315804,81014547,81471385,81466189,81471442,80208211,80230555,81035118,81227142,80237990,80208082,21477429,80208213,81467138,81422962;False;4
80990381;À regarder en un week-end;Move to Heaven;occ-0-2773-2774.1.nflxso.net/dnm/api/v6/6gmvu2hxdfnQ55LZZjyzYR4kzGk/AAAABXIlfEHaZchv5Q5lgSqzV9U9g19asUhqdJftMwOrnlIpDI7zGEUnzoYW1ERkXxFrWtmvYLY1DUqp4Gk35Ueubbp119FHtHsRXgn8dalMryQZxy6EA56lgugyppqYZE9CVs3D.jpg?r=88a;2021;10 Épisodes;;13+;Un jeune homme méticuleux et son oncle, qu'il connaît à peine, mettent en ordre les affaires des défunts et offrent une dernière histoire à leurs proches.;;0;;Lee Je-hoon,Tang Jun-sang,Hong Seung-hee,Ji Jin-hee,Lim Won-hee,Choi Soo-young;;Séries dramatiques,Coréen;Émotion;81442115,80990668,81672245,81568400,81473201,81503026,81552615,81568411,81568842,81612967,81594904,81443941,81280917,81087762,81472752,81406881,81016276,80987077,81610895,81483827,80241181,81422314,81671939,80998941;True;1
80990668;À regarder en un week-end;Extracurricular;occ-0-2773-2774.1.nflxso.net/dnm/api/v6/6gmvu2hxdfnQ55LZZjyzYR4kzGk/AAAABUEgL6PD0HqmjP7r0OfXU-HVkS9BY2EZSOEj3SbI9JbJ9meG7Gb6olIMk6m59_Pz3Me0vVqxzKJlIXUcGr5DF9wEn4llQevX9ywiOF0cVB09IEYkRXO9x-UjjxhsOCO6XXnH.jpg?r=f38;2020;10 Épisodes;;16+;Un lycéen modèle impliqué dans des activités criminelles voit sa double vie menacée lorsqu'une de ses camarades de classe commence à s'intéresser à ses secrets.;violence, violence sexuelle;0;;Kim Dong-hee,Jung Da-bin,Park Ju-hyun,Nam Yoon-su,Choi Min-soo,Kim Yeo-jin,Park Hyuk-kwon;;Coréen,Séries pour ados,Thrillers TV;Sombre;80241947,81640988,81552615,81568217,81030062,81090386,81413647,80188730,81280917,81087762,81357268,81472752,81478985,81552562,81406881,81610895,81483827,81422314,81577271,81482512;True;1
80990771;À regarder en un week-end|Documentaires;L'essor de l'Empire ottoman;occ-0-2773-2774.1.nflxso.net/dnm/api/v6/6gmvu2hxdfnQ55LZZjyzYR4kzGk/AAAABe1-WuFvDEOBUDZ3lHVgeYcvswZ5sDjIhudd_SJwonrq8vpflcj6nWCClVjX3hpU00-nrdVVfNrCwNieSXYUSB7PDxb2EoJKvos1RZPI9tCartHKEMDx8lR91ULAc-D4nm-1.jpg?r=3f0;2022;2 Saisons;Recommandé à 55 %;16+;Le sultan ottoman Mehmed II mène une campagne épique pour s'emparer de la capitale byzantine de Constantinople et façonne le cours de l'Histoire pour les siècles à venir.;violence;0;;Charles Dance,Cem Yiğit Üzümoğlu,Daniel Nuță,Ali Gözüşirin,Nik Xhelilaj,Radu Andrei Micu,Tuba Büyüküstün,Tommaso Basili,Selim Bayraktar,Birkan Sokullu,Osman Sonant,Tolga Tekin,Damla Sönmez,Ushan Çakır,İlayda Akdoğan;;Turc,Documentaires historiques,Séries d'action et d'aventure,Documentaires sur l'armée,Séries documentaires;;60011663,81582615,80083594,81064069,81466297,80017529,81024039,70301870,81603987,81417796,70305899,80182016,80161728,81471290,81035118,80237990,80098202,80175352,80123615,80133543,80241181,80176893,70056440,81650731,80014727;True;2
80991107;Seulement sur Netflix|Séries dramatiques|Séries internationales|Films d'époque;Mr. Sunshine;occ-0-2773-2774.1.nflxso.net/dnm/api/v6/6gmvu2hxdfnQ55LZZjyzYR4kzGk/AAAABWuMHBRXvckXkRfqWoVUjDKOW857LzEKYAHIawk5cxjLFCy8Gc1hZYmD9RgkZIdHfkLfCBW3PV91jPNvajph7fMj6QVKdAjweNvXrz_lwJV-oYpOtHrr7S5-zpGe_SsF7J9o.jpg?r=267;2018;24 Épisodes;Recommandé à 65 %;16+;Débarqué aux États-Unis en 1871 après l'expédition du Shinmiyangyo, un jeune homme retourne plus tard en Corée où il tombe sous le charme d'une ravissante aristocrate.;violence;0;;Lee Byung-hun,Kim Tae-ri,Yoo Yeon-seok,Byun Yo-han,Kim Min-joung,Kim Gap-soo,Choi Mu-sung,Kim Eui-sung,David Lee McInnis,Kim Byong-chul,Lee Seung-jun,Kang Shin-il,Jo Woo-jin,Lee Ho-jae;;Séries dramatiques romantiques,Séries politiques,Séries dramatiques,Coréen,Films d'époque;Doux-amer,Émotion,Romantique;81116487,81442115,81243992,81672245,80123798,81486372,81683746,81033645,81482476,81568842,81193309,81239224,80986896,81159258,81473182,81279108,80188730,81260283,81280917,81649877,81028895,81161487,81205849,80196931,80031790,81517168,81610893,80093324,80180171,81267722,81422314,81463556,80998941;True;4
80991848;Séries US|Séries dramatiques|Séries à regarder sans modération;Sex/Life;occ-0-2773-2774.1.nflxso.net/dnm/api/v6/6gmvu2hxdfnQ55LZZjyzYR4kzGk/AAAABa8GxufFsposGqOzVPKfp-8glMuQQll7UMWunXhUbhYqrOgVneYQj5OM3LGxTbqTpGIH_IgAFEUgPY-b7STXyLb5NImgB-pEyXG017kYNnJcQPrQVHjYdqHbuGzymH3hIDgv.jpg?r=f95;2023;2 Saisons;Recommandé à 88 %;18+;Son présent de femme mariée et son passé amoureux licencieux se télescopent quand son ex, sur lequel elle fantasme toujours, fait irruption dans sa vie.;sexe;0;;Sarah Shahi,Mike Vogel,Adam Demos,Margaret Odette;;Séries dramatiques romantiques,Séries dramatiques,Séries inspirées de livres,Séries US;Torride,Intimiste;80013872,81058385,80131194,81489770,81252980,81397576,70211042,80057784,81036622,81388078,81381634,80098467,81393836,81245964,81425117,80095411,81498384,81043665,81140470,70294663,81513875,80176893,80241181,81092120,81438166,70167075,81397579;True;5
80992058;Séries policières;Kaleidoscope;occ-0-2773-2774.1.nflxso.net/dnm/api/v6/6gmvu2hxdfnQ55LZZjyzYR4kzGk/AAAABcVQqvm881UYNL-l0FTivoBoUYjM3yqON9KmIblGRWHgRQj7BCDBKGcAN5BfYVMLKk6fTU5sOeavlxB1gK6yg3k6aCjE6jHwspp_C2_HTfIw-Z5UuDfmFhUq_J2wzF8AX0Ff.jpg?r=a5c;2023;Mini-série;;16+;Un maître du braquage et son équipe tentent un casse épique et complexe de sept milliards de dollars, mais la trahison, la cupidité et d'autres facteurs sapent leur plan.;violence;0;;Giancarlo Esposito,Rufus Sewell,Paz Vega,Rosaline Elbay,Jai Courtney,Tati Gabrielle,Peter Mark Kendall;;Séries d'intrigue,Séries d'action et d'aventure,Séries policières,Séries US,Thrillers TV;Suspense;70143836,80017529,70056430,81252980,70102746,81396545,81279324,70020509,60001393,60022974,70065116,81458368,81417796,80185171,70281312,81161789,81488967,80098202,81444818,80240371,81509422,80133543,81198448,80237937,81239598,81249833;True;1
80992775;Séries d'action et d'aventure|Films d'époque;La Révolution;occ-0-2773-2774.1.nflxso.net/dnm/api/v6/6gmvu2hxdfnQ55LZZjyzYR4kzGk/AAAABfKy3uxT2Eo2V0KllStdl1BOaj2n12FvlkTeNfK9EVP8Tpgijyk9BSz1HgLWn6g9MwBEK6IT03EQE2eBj7B448Tjk5oyuNV0QYdlEcz6GUYPjQAXabD3RD4ZW-2cN9QFDlUJ.jpg?r=df2;2020;8 Épisodes;;16+;Dans une réécriture de l'Histoire, une mystérieuse maladie frappe la France du 18e siècle, déclenchant un affrontement brutal entre aristocrates et rebelles.;violence;0;;Amir El Kacem,Marilou Aussilloux,Lionel Erdogan,Isabel Aimé Gonzalez Sola,Julien Frison,Doudou Masta,Dimitri Storoge,Amélia Lacquemant,Coline Beal,Laurent Lucas,Gaia Weiss,Chiara Tantimonaco,Nina Tantimonaco,Pierre Andrau,Philippine Martinot,Jérémie Covillault;;Français,Séries politiques,Séries d'action et d'aventure,Films d'époque,Séries d'épouvante;Violent,Effrayant;81582615,80222934,81354529,81085467,80017529,80099656,70305883,81414644,81564749,81024039,81267689,70301870,70213223,80094273,80150507,80244780,80213020,80182016,80161728,81166149,80190859,80119411,81140933,80175352,81249833,80189685;True;2
