ID;categorie;titres;liens_images;année;durée;score_recommendation;age_conseillé;description;prévention;mise_en_avant_supplémentaire;réalisation;distribution;scénariste;genres;avertissement_programme;recommendations;netflix_original;nombre_occurrence
80095900;Pour se détendre;Haters Back Off;occ-0-2773-2774.1.nflxso.net/dnm/api/v6/6gmvu2hxdfnQ55LZZjyzYR4kzGk/AAAABa9Cgd_OprU-KS8UD6SrSN1ikMJTnzExx7MJpSY5-6Jcvb6eh5S8unFXXoPnO6RfQuhO6bD_nPx0LmpqbliAIrcqg-DLIbR7w0Xc7R8_53_St_uoXo75lxWKJUZN7cuib5nv.jpg?r=43f;2017;2 Saisons;;7+;Miranda Sings n'a aucun talent, mais elle est persuadée du contraire. Bien décidée à devenir une superstar, elle s'embarque dans une quête délirante de la célébrité.;;0;;Colleen Ballinger,Angela Kinsey,Francesca Reale,Erik Stocklin,Steve Little;;Séries pour la famille à voir ensemble,Séries pour ados,Séries comiques,Séries US;Absurde,Insolite;80174285,80994878,80222822,80027564,80190146,80201035,81475311,80231658,80234451,81011712,81186615,81194110,81443738,70172485,80031800,80042307,60031264,81002412,80179190,80244332,80051137,80020540,81209537,80238106,80050008;True;1
80096545;Documentaires;Roman Empire;occ-0-2773-2774.1.nflxso.net/dnm/api/v6/6gmvu2hxdfnQ55LZZjyzYR4kzGk/AAAABYQj3jBWTfgm6LCleN0ZWCPI0dYl6ORZIfulLfnEPpgjfIX4seG4HbYMXuOhQNAFlN-V5dW4BQlLZnlimY7SI-HU-LB3esC_-vBMF0Sn97AFg7t2IpQq20Jvm2d4t_1DNare.jpg?r=67b;2019;3 Saisons;;16+;Entre documentaire et épopée historique, ce captivant récit retrace les règnes agités et violents de Commode, Jules César et Caligula.;violence;0;;Sean Bean,Aaron Jakubenko,Edwin Wright,Mike Edward,Genevieve Aitken,John Bach,Steve West,Ditch Davey,Tim Carlsen,Natalie Medlock,Ben Black,Stephen Lovatt,Ido Drent,Craig Walsh-Wrightson,Kelson Henderson,Colin Moy,Teressa Liane;;Séries dramatiques,Documentaires historiques,Séries documentaires,Docus société et culture,Séries US;;81466297,70305883,80074249,80123615,81064069,80237990,80989772,80990771,80161728,81507267,80175352,80182016,70301870,81211003,80211648,81650731,81230204,80989924,80190859,81035118,81582615,81024039,81149450,81488464,80138915,81467138;True;1
80096984;Pépites pour vous;Amateur;occ-0-2773-2774.1.nflxso.net/dnm/api/v6/6gmvu2hxdfnQ55LZZjyzYR4kzGk/AAAABecoHjbZ84NyQzx7VRnym7_h0VLciwLFIo8Cpl25NuF5oZ2FRyYrNLVeQkTCY6XaW2HxmZAv1nDL0AT6gUwjuNOKEklGOFh2yvsAQSIpzLSet0XaT1ekd2sC6Y9oA8y-Q8pu.jpg?r=28a;2018;1 h 36 min;;13+;Après avoir été recruté par une école préparatoire d'élite, un jeune prodige du basket est confronté à la corruption et à la cupidité qui règnent sur les sports amateurs.;;0;Ryan Koo;Michael Rainey Jr.,Josh Charles,Brian White,Sharon Leal,Ashlee Brian,Corey Parker Robinson;Ryan Koo;Drames,Films indépendants,Films pour ados;Émotion;80999009,328438,60024922,80226923,81292345,80216302,81135138,80217669,81211064,70119811,80207506,80176893,80097391,70044605,81368729,80074781,80179190,80242342,80177416,70201437,80058397,81043365,80117458,81435227,81121351,80244479;True;1
80097140;Séries policières|Séries de SF et d'horreur;Altered Carbon;occ-0-2773-2774.1.nflxso.net/dnm/api/v6/6gmvu2hxdfnQ55LZZjyzYR4kzGk/AAAABTn0-KC5Vsd50WOS_g0zqtpB9vzHKGV6osC2ESWJxo4i93vjUkMcIspXUesSnukw09axX8b6LMMzd45jx4EQzeP2acVVYGvC702fQqeDVyIneZpFwPIIbg7L1TUUsskL8pT_.jpg?r=01b;2020;2 Saisons;;16+;Sur la touche pendant 250 ans, il revient dans un nouveau corps pour enquêter sur un meurtre ahurissant. S'il résout l'affaire, il retrouvera la liberté.;violence, violence sexuelle;0;;Anthony Mackie,Lela Loren,Simone Missick,Chris Conner,Dina Shihabi,Torben Liebrecht,Renée Elise Goldsberry,Joel Kinnaman,James Purefoy,Martha Higareda,Dichen Lachman,Will Yun Lee,Kristin Lehman,Ato Essandoh,Tamara Taylor,Byron Mann;;Séries SF,Séries inspirées de livres,Séries d'action et d'aventure,Séries policières,Séries US;À énigmes,Violent;80189685,80104198,81444051,80171099,80202133,70056430,80100172,81483047,70283264,81165134,80236236,81397077,80105699,80174608,81054853,80993062,80241318,80014749,80177458,70264888,80025744,80098202,80214512,80044950,81074110;True;2
80098202;Films d'action et d'aventure|Tendances actuelles|Blockbusters;Jason Bourne;occ-0-2773-2774.1.nflxso.net/dnm/api/v6/6gmvu2hxdfnQ55LZZjyzYR4kzGk/AAAABQOp6RKXsVNlIV9ZWkoWGURpstWJ3BoHiJIePIGObfSKcdFyK01-QY6yrOPbWLaZcKrBOHw1cNgTqVXt3AcziMVWn2nmDzZgFXlx_oZHgMhuoEqj_b-Y8jM1umczVWuxwiGv7JPEAGa32WWzur-LZ7-GAuuxQ1amx98.webp?r=a6f;2016;2 h 3 min;;13+;"Sorti de la clandestinité, l'ancien espion enquête sur un cybercrime et sur la mort mystérieuse de son père dans cette suite de ""La Vengeance dans la peau"".";;4;Paul Greengrass;Matt Damon,Tommy Lee Jones,Alicia Vikander,Vincent Cassel,Julia Stiles,Riz Ahmed,Ato Essandoh,Scott Shepherd,Bill Camp,Vinzenz Kiefer;Paul Greengrass,Christopher Rouse;Films inspirés de livres,Films d'action;Montée d'adrénaline;80133543,80017529,81444051,60028308,70251536,80071227,70056430,81370440,60022974,70035186,81165134,81557402,70281312,70208104,80236390,81612863,81397077,70065116,80210920,81030627,81304948,80013871,60029196,70305892,70020509,80190534;False;4
80100172;Séries internationales|Séries de SF et d'horreur|Thrillers TV|Séries policières|Séries saluées par la critique;Dark;occ-0-2773-2774.1.nflxso.net/dnm/api/v6/6gmvu2hxdfnQ55LZZjyzYR4kzGk/AAAABYuKjjKMzFh6RN2q7ml5nJDrNguQzImqCdD7tTYKKUXYnliwYVjasxzPERdiwpcDhL8zqUyaRHnRhYWtajxpwaRLf1FUTtHR7CGGFkn028rZF0CCpGfBAYA-e6H0DdaVUrdO.jpg?r=393;2020;3 Saisons;;16+;Quatre familles affolées par la disparition d'un enfant cherchent des réponses et tombent sur un mystère impliquant trois générations qui finit de les déstabiliser.;sexe, suicide;0;;Louis Hofmann,Oliver Masucci,Jördis Triebel,Maja Schöne,Karoline Eichhorn,Sebastian Rudolph,Anatole Taubman,Mark Waschke,Stephan Kampwirth,Anne Ratte-Polle,Andreas Pietschmann,Lisa Vicari,Michael Mendl,Angela Winkler;;Allemand,Séries SF,Séries d'intrigue,Séries policières,Thrillers TV;À énigmes,Cérébral,Suspense;80117552,80022632,81023636,81133094,80222802,80214497,80108495,70283264,70143836,80236236,80105699,80174608,80993062,81008221,80241318,80014749,80179190,80177458,80097140,70264888,80025744,80135414,80154610,80044950,80057281,70305903;True;6
80100929;Séries internationales|Séries dramatiques|Seulement sur Netflix|Films d'époque;Les Demoiselles du téléphone;occ-0-2773-2774.1.nflxso.net/dnm/api/v6/6gmvu2hxdfnQ55LZZjyzYR4kzGk/AAAABeRrDkNpxfc-soQLNaJxrmQs9YasZ-IeJgjN0eAPYw-wo8QZ9HBDA71YQ25KT8nxgXVRaU-CoK6-CPCdJ3QSr-_5TgeZ9ACVoTWVRnYvxbWlEnb37N0LrCRP5aNbnwbJttQm.jpg?r=92d;2019;6 Saisons;;16+;Les années 1920 à Madrid. Quatre opératrices de la Compagnie Nationale du Téléphone sonnent la révolution en gérant amour et amitié dans un milieu professionnel moderne.;drogue;0;;Blanca Suárez,Yon González,Ana Fernández,Nadia de Santiago,Ana Polvorosa,Nico Romero,Denisse Peña,Raúl Mérida,Miguel Diosdado,Ángela Cremonte,Valentina Zenere,Concha Velasco,Ana Risueño,Martiño Rivas,Antonio Valero,Gary Piquer,Alex Hafner,Kiti Mánver,Marcial Álvarez,Maggie Civantos,Borja Luna,Sergio Mur,Antonio Velázquez,Ernesto Alterio,Iria del Río,Andrea Carballo;;Séries dramatiques romantiques,Séries dramatiques,Espagnol,Films d'époque;Doux-amer,Émotion;80212986,80233258,70213223,81476441,81481539,81564749,80176893,70285581,80232398,80136311,81473474,81476183,80070050,80241318,80179190,81304948,81031939,81577050,81354529,81140933,81222923,81590491,80213020,80119411,81414644,80241181;True;5
80101899;Pépites pour vous|Drames;Le Fondateur;occ-0-2773-2774.1.nflxso.net/dnm/api/v6/6gmvu2hxdfnQ55LZZjyzYR4kzGk/AAAABW3UK9J8Jgdikn46GWJ33RBzdISnfliafMzhGrrNcpfvwbH0M_GeDM0DkKIS5e58txfSZjP4MEUX_rNWsTFdZipW-beattt9LG0.webp?r=b91;2016;1 h 55 min;;10+;Après une rencontre décisive avec les frères McDonald, Ray Kroc, représentant de commerce raté, se met en tête de révolutionner la confection et la vente de hamburgers.;;0;John Lee Hancock;Michael Keaton,Nick Offerman,John Carroll Lynch,Linda Cardellini,Patrick Wilson,B.J. Novak,Laura Dern;Robert Siegel;Drames,Films inspirés de faits réels;Intimiste;81058432,60011152,81211846,60024942,70144327,60024922,70084788,80075560,70114497,81064867,70119811,80226212,80176893,80097391,70143836,70132721,80015343,70044605,80121192,81232236,70270877,81092221,70201437,60022967,80021955,80241181;False;2
80103408;Pour enfants|Tendances actuelles|Séries jeunesse et famille;Teen Titans Go!;occ-0-2773-2774.1.nflxso.net/dnm/api/v6/6gmvu2hxdfnQ55LZZjyzYR4kzGk/AAAABTid667EH1J2w4eMxVo9vqe6inUwfkFYyOE9MfCl-cpujT61f7CbL8HZ4G0zMuxfXljrUE_AYXGouMlh1isyYoSjLCIgmYL31eg.webp?r=484;2019;5 Saisons;;10+;Quand ils ne sont pas en train de se chamailler, les colocataires et super-héros Robin, Starfire, Raven, Changelin et Cyborg protègent Jump City contre les malfaiteurs.;;0;;Greg Cipes,Scott Menville,Khary Payton,Tara Strong,Hynden Walch;;Pour enfants,Séries comiques,Dessins animés,Séries inspirées de B.D.;Décalé;81193032,70286809,81287545,80164216,81026605,80155771,81312563,81045859,80994666,81186615,81589565,81186971,81616116,70252973,80200487,81294811,70155579,60031264,80011621,81068804,70011204,81145135,81483908,70252898,81154166,80242531;False;3
80104198;Pépites pour vous|Séries jeunesse et famille|Seulement sur Netflix;Perdus dans l'espace;occ-0-2773-2774.1.nflxso.net/dnm/api/v6/6gmvu2hxdfnQ55LZZjyzYR4kzGk/AAAABRoVtJnhi6PAdoMpsSmt4iZ7qPYYZHcTBB3wD_NPNyNJoeEemi8aJa1UVGY0pTEjYbraMsWCwiCzx6xj0f5o6cgWJW5rE44kyvNkYvVnChYgXizGK6JkgzG6WyrWkToK7LnU.jpg?r=2c8;2021;3 Saisons;;10+;Après s'être écrasée sur une planète inconnue, la famille Robinson lutte avec détermination pour survivre et fuir. Mais de mystérieux dangers l'entourent.;;0;;Molly Parker,Toby Stephens,Maxwell Jenkins,Taylor Russell,Mina Sundwall,Parker Posey,Damien Witecka;;Séries pour la famille à voir ensemble,Séries d'action et d'aventure,Séries US;Suspense;81037539,80189685,81023636,80236319,80198988,80171099,80202133,80195967,70283264,81165134,81309354,80222326,81098012,80236236,81010971,80993062,80170280,80241239,80241318,80177458,80117803,80158764,80097140,80154610,80214512,70305903;True;3
80105699;Thrillers TV|Séries de SF et d'horreur;Les voyageurs du temps;occ-0-2773-2774.1.nflxso.net/dnm/api/v6/6gmvu2hxdfnQ55LZZjyzYR4kzGk/AAAABY_uYwFdi2BH9WE8cFISbwrAdKDQMWpS9LLqRfGMCsbnyQvqd4D8tQumVr6P1xY9q0CZoQXk_sxNpf-857Kx6zADD1OC4kv6Cb4lw9RAIylPzvhddXObPFOUMk5ahHxfj4Rk.jpg?r=b14;2018;3 Saisons;;16+;Un agent du FBI traque quatre personnes qui semblent avoir soudainement changé de personnalité et fait une découverte inconcevable sur l’avenir de l’humanité.;violence, violence sexuelle;0;;Eric McCormack,MacKenzie Porter,Nesta Cooper,Jared Paul Abrahamson,Reilly Dolman,Patrick Gilmore;;Canadien,Séries SF,Thrillers TV;Sombre;80022632,81023636,80104198,81444051,80171099,70056430,80100172,70283264,80176893,81580045,80236236,81397077,81612863,81008221,80993062,80241318,80014749,80179190,80177458,81304948,80097140,80025744,80154610,80077417,80044950,80241181;True;2
80106136;Pour enfants|Anime;Yo-Kai Watch;occ-0-2773-2774.1.nflxso.net/dnm/api/v6/6gmvu2hxdfnQ55LZZjyzYR4kzGk/AAAABSj_dcifJ1nzZYL8trfss6Pxb3QP7Pu-2MOVhr2XfWxhg7vanNeaSgM8-LOd9AsxLxbSTFFX7AezMJDfPCJJ13QR0KgVp-cZ8Cg.webp?r=810;2015;26 Épisodes;;7+;Nathan libère un esprit prisonnier d'une capsule magique et les deux nouveaux amis partent à l'aventure avec toutes sortes de créatures surnaturelles et rusées.;;0;;Johnny Yong Bosch,J.W. Terry,Alicyn Packard,Melissa Hutchison,Pierre Holloway,Brent Pendergrass;;Pour enfants,Japonais,Anime inspiré d'un jeu vidéo,Séries d'animation japonaise;;81670673,80103408,80007912,81628818,81093076,81045859,81280792,80007757,81186971,80003196,81567663,70297439,80062112,81616116,80221337,70252973,81193140,70177034,81294811,81172568,81172267,81026767,81291575,81206965,80242531,80201492;False;2
80106337;Films et séries suédois;Le Vieux qui ne voulait pas payer l'addition;occ-0-2773-2774.1.nflxso.net/dnm/api/v6/6gmvu2hxdfnQ55LZZjyzYR4kzGk/AAAABbC5fR73HdCMN35FWiLwpU7igJSwKIij-bMCV6vlk1jP4pkleZDzUyDGlUqm5Sy52DKf69KVScDCZvsEWO3CRG4AraNeH4bGm475Nzjy3yndBiWbTRvmtblF_UkD8knXhGou.jpg?r=ad4;2016;1 h 48 min;;13+;Un ancien espion centenaire, excentrique et sans le sou, entraîne un jeune octogénaire au bout du monde pour retrouver la formule d'un soda datant de l'ère soviétique.;;0;Felix Herngren,Måns Herngren;Robert Gustafsson,Jens Hultén,Caroline Boulton,Colin McFarlane,Cory Peterson,Jay Simpson,David Schaal;Felix Herngren,Hans Ingemansson;Suédois,Satires,Comédies,Films d'espionnage;Absurde,Décalé;80202273,70118780,81034010,70125231,60020828,81466149,81318514,81212842,81165134,80202918,80988834,70123711,80073160,80200487,215309,81382206,81088495,81663276,81113742,81581068,70136120,81580584,81623190,80242619,70295562,81041317;True;1
80107369;Séries d'action et d'aventure;Reine du Sud;occ-0-2773-2774.1.nflxso.net/dnm/api/v6/6gmvu2hxdfnQ55LZZjyzYR4kzGk/AAAABeJsBcn6IrJLJVowG_eqfJbaEFZd5L5X3U2oupNrp95feoFaBxDwemAYer6CNunZB_XopqBk4N87g4CYkZxyOLQfPoPAkbcO8iw.webp?r=158;2021;5 Saisons;;16+;Contrainte de travailler pour le cartel qui a assassiné son petit ami, Teresa s'en remet à son instinct, à une amie fidèle et à un mystérieux carnet pour survivre.;violence, drogue, violence sexuelle;0;;Alice Braga,Hemky Madera,Peter Gadiot,Veronica Falcón,Molly Burnett,Joaquim de Almeida,Yancey Arias,Justina Machado,Gerardo Taracena;;Séries inspirées de livres,Séries d'action et d'aventure,Séries US;Violent;;False;1
80113612;Séries d'action et d'aventure;Fauda;occ-0-2773-2774.1.nflxso.net/dnm/api/v6/6gmvu2hxdfnQ55LZZjyzYR4kzGk/AAAABYkbaa6X5_eDoRn64CXI898aDwAY1-ZpSO4wySGbUF1fcX29DDAnf-RyriBE0MGw03FXcuSTdkLgRKoZaBoIbk7qk8O89veHKNZQ0u0Uw2MSjzEhvztK_qg4EwxiuxT3I09c.jpg?r=700;2023;4 Saisons;;16+;Un agent israélien interrompt sa retraite pour traquer un combattant palestinien qu’il pensait avoir tué et déclenche ainsi une série d’événements dramatiques.;violence;0;;Lior Raz,Itzik Cohen,Hisham Suliman,Shadi Mar'i,Laëtitia Eïdo,Yuval Segal,Netta Garty,Tomer Kapon,Tsahi Halevi,Yaakov Zada Daniel,Doron Ben-David,Rona-Lee Shim'on,Idan Amedi,Boaz Konforty,Jonathan Avigdori,Aylam Orian,Meirav Shirom,Jameel Khoury,Assaf Cohen,Firas Nassar,Igal Naor,Matt Gottlieb,Ala Dakka,Khalifa Natour,George Iskandar,Marina Maximilian Blumin,Lucy Ayoub,Amir Boutrous,Inbar Lavi,Loai Nofi,Reef Neeman;;Israélien,Séries d'action et d'aventure,Thrillers TV;;81166149,80067930,81388035,80144454,81417796,80188120,80207506,81576597,81564749,81354934,80235864,81478537,81557402,81288983,81397077,80185171,80178151,80241318,81423620,81147725,80013871,81465109,81041495,80240005,81021294,80205626;True;1
80113647;Séries US|Thrillers TV|Seulement sur Netflix;Designated Survivor;occ-0-2773-2774.1.nflxso.net/dnm/api/v6/6gmvu2hxdfnQ55LZZjyzYR4kzGk/AAAABYjlRogxNqGQJCO4M6cs-bhQ-adN_E2qkvvY7H8fV1XXoiYkxFKYNiLWkBhT0JU269ofyZmkhETjBAZ7hv9L5GJdaFtSi0jvk3hihYSmp466tCUcR3gkOsULGVOVGI0svn7x.jpg?r=c75;2019;3 Saisons;;13+;Dans ce passionnant thriller politique, le sort de l'Amérique repose dans les mains d'un petit fonctionnaire après qu'une attaque sur Washington a décimé le gouvernement.;;0;;Kiefer Sutherland,Maggie Q,Kal Penn,Adan Canto,Italia Ricci,Anthony Edwards,Julie White,LaMonica Garrett,Natascha McElhone,Geoff Pierson,Lauren Holly,Elena Tovar,Benjamin Charles Watson,Mckenna Grace,Tanner Buchanan,Thomas Roditi,Paulo Costanzo,Zoe McLellan;;Séries politiques,Séries US,Thrillers TV;Suspense;70264801,70178217,81417796,70056430,81161372,80207506,70195800,80235864,80176893,81450827,80024057,70281312,81476183,70208104,81288983,81397077,80195198,81072109,80185171,80210920,81396545,80241318,80013871,80098202,81303831,80241181;True;3
80113701;Séries US;The Good Place;occ-0-2773-2774.1.nflxso.net/dnm/api/v6/6gmvu2hxdfnQ55LZZjyzYR4kzGk/AAAABcfWu80zKMtgKtV-mohY0RKAfeWXBeOAB0L_Dg_V6o-PROm3lez2EjtWYSjwfjBap-U8l43z4kEJAu8xa3Lqt0uoMb_eDJriCK0QRhRCj2j7mBECflXGtj6yVKH5NKh3B2wp.jpg?r=ec4;2020;4 Saisons;;13+;À sa mort, l'égocentrique Eleanor Shellstrop se retrouve par erreur dans un monde paradisiaque. Déterminée à y rester, elle va tenter de devenir une meilleure personne.;;0;;Kristen Bell,Ted Danson,William Jackson Harper,Jameela Jamil,D'Arcy Carden,Manny Jacinto;;Sitcoms,Séries comiques,Séries US;Décalé;80198991,80017537,70143830,70140358,81500842,81468289,81288370,80095532,81327503,70281562,80027158,81305952,70153404,80177342,81281864,80014749,80179190,81092963,70155618,80025384,70155589,70136120,80095815,81021929,81516751,81447461;True;1
80114855;Séries policières|Thrillers TV;MINDHUNTER;occ-0-2773-2774.1.nflxso.net/dnm/api/v6/6gmvu2hxdfnQ55LZZjyzYR4kzGk/AAAABZHgsFpqTgzuCQkss960_rQM4fwNjQip2ObMYNsH-YqooQF6vvg2F_HqyY0WTBjhCEvAHyNjCqVRZXq1-SyhqS7lCwW2mWeeHHggPcyWbj6BmVODj4CClkp95b3E31cDZx2Y.jpg?r=2f1;2019;2 Saisons;;16+;À la fin des années 1970, deux agents du FBI font avancer la criminologie en s'intéressant à la psychologie du meurtre et en se rapprochant de monstres hélas bien réels.;;0;;Jonathan Groff,Holt McCallany,Anna Torv,Cotter Smith,Hannah Gross,Michael Cerveris,Joe Tuttle,Albert Jones,Stacey Roca,Cameron Britton;;Séries inspirées de livres,Séries d'intrigue,Séries policières,Séries US,Thrillers TV;;81028570,80117552,80153467,81015514,81287562,80206099,81332052,80216172,80207506,80002479,80244630,70143836,81450827,80024057,70281312,81397077,80025172,80241318,70272726,80175802,81495803,81303831,80200549,80190534,80021955,80241181;True;2
80115031;Films et séries jeunesse;Divines;occ-0-2773-2774.1.nflxso.net/dnm/api/v6/6gmvu2hxdfnQ55LZZjyzYR4kzGk/AAAABVozkJNRdr1ObDp3X295llRkJy5al2sneFw_CF42n2NsA1nCgxhSVuBY6wHQYAFkZbL8R-2YSeIcuhp4Q9rFEMRk3lKjALaLNWI.webp?r=59a;2016;1 h 46 min;;16+;Une adolescente astucieuse et sa meilleure amie décident de devenir riches à tout prix. Pour cela, elles vont suivre les traces d'une dealeuse reconnue.;violence, drogue;0;Houda Benyamina;Déborah Lukumuena,Jisca Kalvanda,Kévin Mischel,Majdouline Idrissi,Oulaya Amamra,Yasin Houicha;Houda Benyamina,Romain Compingt,Malik Rumeau;Français,Drames,Drames primés;Sombre,Intimiste,Émotion;80194671,81585959,80144454,81120982,81135138,80207506,81034661,81093101,81191429,81623351,81248121,80115029,80179190,80198859,81076535,81081603,81312536,81312828,80058397,80197327,81030213,80058426,81034012,80190534,70285701,81290742;False;1
80116922;Documentaires;Inside the World’s Toughest Prisons;occ-0-2773-2774.1.nflxso.net/dnm/api/v6/6gmvu2hxdfnQ55LZZjyzYR4kzGk/AAAABS_jEzXFZ36NOfV3EDeFMiX0j6-xdoiEf5yKINvTNtAudPq5Ajsl90oE4XKcLapnzZD2HAkeObHHrXbeHkdlybOwSx2JZmj5sQ1QkC13oNWe4oJISRHH9zopdBLFkVhizyfp.jpg?r=3f9;2022;6 Saisons;;16+;Des journalistes d'investigation se font volontairement enfermer dans les pires prisons du monde où intimidation et violence font loi.;drogue, violence sexuelle;0;;Paul Connolly,Raphael Rowe;;Britannique,Séries documentaires;Enquête;81250179,81508443,80216756,80996810,81350804,81436777,81169145,81013210,81317673,80199963,81227743,81300060,80177803,81231181,80202283,80178726,81264650,70267802,81026055,81153133,80190843,80217818,80165247,81580822,81384842,81173345;True;2
80117038;Animation pour adultes;Big Mouth;occ-0-2773-2774.1.nflxso.net/dnm/api/v6/6gmvu2hxdfnQ55LZZjyzYR4kzGk/AAAABRopyssXMefCQFU3dpXqIp9BdepkSp-oXbGG5hn2QFNVAwazvlco13sDEb_I26sdeV1N1Z5vC7-KRK7uZO--W4wyUpn8op77cbJEGdkHneMVbfDQ0RtfkWuOA8PbiSnipmOs.jpg?r=a05;2022;6 Saisons;;16+;Délices et horreurs de la puberté chahutent un groupe d'ados dans cette comédie décapante créée par deux copains de longue date, Nick Kroll et Andrew Goldberg.;sexe, nudité, langage grossier;0;;Nick Kroll,John Mulaney,Jessi Klein,Jason Mantzoukas,Fred Armisen,Maya Rudolph,Jordan Peele,Maria Bamford,Jenny Slate,Gina Rodriguez,David Thewlis,Ali Wong,Chelsea Peretti,Bobby Cannavale,Andrew Rannells,Zachary Quinto,Ayo Edebiri;;Sitcoms,Séries comiques,Séries US;Décalé;80028732,81259476,81053303,81214194,80095697,81662953,80191522,81039557,81067223,81580024,81304528,70300800,81165134,81324724,80987903,70281562,70153404,80231433,81008138,80014749,80179190,80241499,80174479,80235932,80995819;True;1
80117445;Films d'action et d'aventure|Mondes épiques|Blockbusters;Assassin's Creed;occ-0-2773-2774.1.nflxso.net/dnm/api/v6/6gmvu2hxdfnQ55LZZjyzYR4kzGk/AAAABQAO92wTD-pJTjQwfLTY-RDcKq4HiTMaef4EPTBmQzI2kQuvu9IUXKBzLLjHbRjwi3h5KMtYjiqCN78Iq6CgFlQg3OkFJxDonSg.webp?r=dac;2016;1 h 55 min;;13+;Grâce à une technologie de pointe, Callum Lynch découvre le lien qui l'unit à une société secrète d'assassins qui lutte depuis des siècles contre l'ordre des Templiers.;;0;Justin Kurzel;Michael Fassbender,Marion Cotillard,Jeremy Irons,Brendan Gleeson,Charlotte Rampling,Michael Kenneth Williams,Denis Ménochet,Ariane Labed;Michael Lesslie,Adam Cooper,Bill Collage;Films SF,Films d'action;;80000603,80133543,80097221,80189685,80017529,81444051,80230399,80236314,70056430,81161626,60022974,80057918,81165134,81557402,70208104,81397077,81612863,80236390,80210920,81030627,70301870,80093133,81038963,80013871,80098202,70020509;False;3
80117470;Films et séries jeunesse|Seulement sur Netflix|Séries US;13 Reasons Why;occ-0-2773-2774.1.nflxso.net/dnm/api/v6/6gmvu2hxdfnQ55LZZjyzYR4kzGk/AAAABT5lJUV_6k1KEwVmKoyvLrEzSwWcqn5ttFEH5zFWhY2ag8KkKLkbLwswm3Mk5Q8moRWIEgOpocFELRHi6m7e35P6hcwZim9Gn0YD6gDL2p6IhO70FAGbbzFBQ3D1k2Q74GKy.jpg?r=1a2;2020;4 Saisons;;16+;Le jeune Clay Jensen se retrouve au centre d'une série de secrets déchirants qui prennent un tour tragique après le suicide d'une camarade de classe.;violence, sexe, drogue, violence sexuelle, suicide;0;;Dylan Minnette,Katherine Langford,Alisha Boe,Brandon Flynn,Justin Prentice,Ross Butler,Christian Navarro,Devin Druid,Miles Heizer,Brenda Strong,Grace Saif,Kate Walsh,Derek Luke,Timothy Granaderos,Amy Hargreaves,Wilson Cruz,Anne Winters,Bryce Cass,RJ  Brown,Brian d'Arcy James;;Séries dramatiques,Séries inspirées de livres,Séries pour ados,Séries d'intrigue,Séries US;Sombre,Suspense,Émotion;81444051,80243706,80230561,80175722,81017308,81001036,80211991,80133311,81459931,81324724,80176893,81342553,80236318,81021245,80211686,80241318,80179190,70140438,80117809,80197526,81059939,80197989,81025696,81210762,80200942,80212986;True;3
80117540;Films et séries jeunesse;Atypical;occ-0-2773-2774.1.nflxso.net/dnm/api/v6/6gmvu2hxdfnQ55LZZjyzYR4kzGk/AAAABW5asSygL9YppUAeeyKMkTn7yjN7x-FoHrgbAdTBSFeXP0bjN6PKqJPZuwhhnWwBAoagRkhSoe6Yi6h1ruoYkIhp84DvtLFFBJczg1ofkm8YJ7AyfvrUrPq5lrWbZLwvh8VV.jpg?r=846;2021;4 Saisons;;13+;Quand un ado autiste décide de trouver une petite amie, sa soudaine soif d’indépendance crée dans toute sa famille une remise en question aussi radicale qu'inattendue.;;0;;Jennifer Jason Leigh,Keir Gilchrist,Michael Rapaport,Brigette Lundy-Paine,Nik Dodani,Jenna Boyd,Graham Rogers,Amy Okuda,Fivel Stewart;;Séries pour ados,Séries comiques,Séries US;Décalé;81249731,81446305,80175722,80230561,81127150,81165134,81324724,80176893,80179905,81342553,80244296,80244781,70153404,80241318,80014749,81078393,80179190,81092963,80117809,70155618,81059939,80197526,81025696,81210762,80212986,80117551;True;1
80117552;Séries US|Thrillers TV|Seulement sur Netflix;Ozark;occ-0-2773-2774.1.nflxso.net/dnm/api/v6/6gmvu2hxdfnQ55LZZjyzYR4kzGk/AAAABeWVUnLavhCav6NuSMWZFQzNqAYPNt3Pf1kzZ3L_gsCTz8PCUAUtFCg556QZHoLQ2oXWlNjSrcnNbKDAJB2hEk7zhQROs69AG4SknEcMQlF8RPFaRYXAU6hXiQVU-3jt7A5Y.jpg?r=b2c;2022;4 Saisons;;16+;Un conseiller financier embarque sa famille au fin fond du Missouri. Il doit y blanchir 500 millions de dollars en cinq ans pour calmer la fureur d'un baron de la drogue.;violence, drogue;0;;Jason Bateman,Laura Linney,Sofia Hublitz,Skylar Gaertner,Jason Butler Harner,Esai Morales,Peter Mullan,Lisa Emery,Julia Garner,Janet McTeer,Charlie Tahan,Jessica Frances Dukes,Damian Young,Felix Solis,Alfonso Herrera,Adam Rothenberg;;Séries US,Thrillers TV;Sombre;70281312,80114855,80153467,80115328,80185171,80217669,80025172,70178217,80192098,80002479,80235864,70236561,80021955,70143836;True;3
80117555;Séries policières|Séries dramatiques;Seven Seconds;occ-0-2773-2774.1.nflxso.net/dnm/api/v6/6gmvu2hxdfnQ55LZZjyzYR4kzGk/AAAABY5gJc4Cl-FOJwpyDDaLdrcev7q81gYXgT2soX94trrClr_HkPbvK3Gfoqg56hc2jA8hk8L6orB2Z4TrfmL33NBxQzPMfdpGqe0hUwYdbMFHH5FGKnwE_Zsai1jr0YbT89ZG.jpg?r=e5c;2018;Mini-série;;16+;La mort d'un garçon afro-américain de 15 ans à Jersey City entraîne le camouflage d'un scandale policier et une recherche de la vérité.;;0;;Clare-Hope Ashitey,Regina King,Beau Knapp,Michael Mosley,David Lyons,Russell Hornsby,Raúl Castillo,Patrick Murney;;Séries dramatiques,Séries policières,Séries US,Séries dramatiques sociales;Sombre,Émotion;81001209,80241855,80153467,81045829,81015514,81417796,81481477,80207506,80201500,81580045,80097391,80176893,80024057,81233755,81288983,81397077,81612863,80185171,80241318,81304948,80175802,81495803,81303831,80200549,80991754,80241181;True;2
80117694;Pour se détendre;Disjointed;occ-0-2773-2774.1.nflxso.net/dnm/api/v6/6gmvu2hxdfnQ55LZZjyzYR4kzGk/AAAABYkFllsg5PzP9HZjYMd6SMGwO9B_VB0vgU53bFafDtrhog2TNmyQ3ivyEoQ6zrM6zT4TZsHPcNWoAthOZiabxdkhjzvQ-z6dlmA8Y8uKdlggzT14gh-hepZVS7ejXODrhjoo.jpg?r=e82;2018;2 Parties;;13+;L'activiste pro-cannabis Ruth Whitefeather Feldman gère un dispensaire médical spécialisé, et encourage ses fidèles patients à se détendre et à profiter de la vie.;;0;;Kathy Bates,Aaron Moten,Tone Bell,Dougie Baldwin,Elizabeth Ho,Elizabeth Alderfer,Chris Redd,Betsy Sodaro,Nicole Sullivan,Michael Trucco;;Sitcoms,Séries comiques,Séries US;Décalé;70143830,81214194,80192186,80209013,81288370,81287254,70208247,81327503,81165134,70113002,80113701,70123711,80987903,81397077,80169617,70281562,70263864,70153404,80014749,81092963,81047664,80235932,70270408,80995819,70136120,80158515;True;1
