ID;categorie;titres;liens_images;année;durée;score_recommendation;age_conseillé;description;prévention;mise_en_avant_supplémentaire;réalisation;distribution;scénariste;genres;avertissement_programme;recommendations;netflix_original;nombre_occurrence
81203371;Films et séries en français;Johnny par Johnny;occ-0-2773-2774.1.nflxso.net/dnm/api/v6/6gmvu2hxdfnQ55LZZjyzYR4kzGk/AAAABYGfKsW3JSFqTmnS65TZvyOBXCe7Adbxgr7cx1pnfABInzHkbmUy-8lrt8cbXGlzN6NTD-enrPyNUIRRK-Mk7YnuDFx7vsrrePM_XdO2Hf1GxBxLX11iddohWbIug_BLRsTS.jpg?r=b1e;2022;5 Épisodes;;13+;Cette série documentaire intimiste sur l’icône du rock raconte le chanteur et l’homme tel qu’il se voyait, à travers des interviews et des images d’archive inédites.;;0;Alexandre Danchin,Jonathan Gallaud;Johnny Hallyday;;Musique,Français,Documentaires biographiques,Séries documentaires;Intimiste;81439256,81512109,80116922,81029777,81275686,80195654,80199963,81300060,81274609,81168281,80190097,81313522,80222157,81447086,80066798,81555750,81026055,81005126,80176322,81313519,81285390,81031929,81177110,80165247,81580822,81216491;True;1
81205849;Séries SF et fantastique;Hotel Del Luna;occ-0-2773-2774.1.nflxso.net/dnm/api/v6/6gmvu2hxdfnQ55LZZjyzYR4kzGk/AAAABYe87kzmOVewAtNqmcEI8wNorFHdogVDS8MV47avOC-8K-EzxiYpSpVWgO6bC9lbw1v7h9I8XsLttiht-Pa78QlNviOE3jNqYMM.webp?r=011;2019;16 Épisodes;;13+;Un directeur d'hôtel à qui on propose de gérer un établissement pour les âmes défuntes fait connaissance avec la propriétaire des lieux et son univers bien étrange.;;0;;IU,Yeo Jin-goo,Shin Jung-keun,Seo Yi-sook,Bae Hae-sun,Pyo Ji-hoon,Cho Hyun-chul,Kang Hong-suk,Lee Do-hyun,Lee Tae-seon,Kang Mi-na,Park You-na,Oh Ji-ho;;Coréen,Séries comiques,Séries comiques romantiques,Séries fantastiques;Décalé,Romantique;81029990,81517188,80039906,81503460,80188662,81260283,81323551,81324724,81465196,81365087,81264882,81243992,81669775,81473182,80188354,81509440,81205775,80025266,80214405,81159258,80123798,81422314,81486372,81042230,81012487,81463556;False;1
81210762;Films et séries suédois|À regarder en un week-end|Séries saluées par la critique;Young Royals;occ-0-2773-2774.1.nflxso.net/dnm/api/v6/6gmvu2hxdfnQ55LZZjyzYR4kzGk/AAAABRxDXw80LCh8AnMBmKGLo4UQ_ZsfOYdtMtefihRtollTFpjiWYvDHE9_U6b09QGf6HFedJV2Gu_qaovLacqp0x6LSGK7Ksqz4D5zJYi78kM16ANHt9jyxi3cKoqDtMbbU1Xu.jpg?r=524;2022;2 Saisons;;13+;Le prince Wilhelm s'adapte à la vie à Hillerska, son nouveau pensionnat prestigieux, mais suivre son cœur s'avère plus compliqué que prévu.;;3;;Edvin Ryding,Omar Rudberg,Frida Argento,Nikita Uggla,Malte Gårdinger,Tommy Wättring,Pernilla August;;Séries dramatiques romantiques,Séries dramatiques,Suédois,Séries pour ados,Séries scandinaves;Émotion,Romantique;80169498,81397897,81017308,81001036,81307103,81459931,81324724,80232398,81342553,81476183,80211686,81258637,81516659,80179190,80168189,81167980,81430236,81059939,81287844,80197526,80197989,81577050,81140933,81033243,80200942,80117470;True;3
81211003;Séries US|Documentaires;À l'aube de notre histoire;occ-0-2773-2774.1.nflxso.net/dnm/api/v6/6gmvu2hxdfnQ55LZZjyzYR4kzGk/AAAABR7MV9wVkUvDaULjiWgc7rQsoeGBOEHXWAKiJ20bIA7FNu12hKkzQnesIH4zWiUNCC6OeW6b8Z4qGb8OEzfFz4Wc4bbfsrhzC8dGenMIECobOmXZE5mfHAc7r13fnxSn1bK1.jpg?r=17a;2022;8 Épisodes;;7+;Le journaliste Graham Hancock parcourt le monde pour découvrir des preuves de l'existence de mystérieuses civilisations perdues depuis la dernière période glaciaire.;;0;;Graham Hancock;;Séries documentaires,Docus société et culture,Séries US;Enquête;81466297,81328829,81243961,81273453,81064069,81346975,80237990,80989772,81317673,81500204,81410405,81554159,81343342,80049832,81018709,81447086,80229847,70267802,81026055,81035118,81014547,80096545,81307163,81471470,81183477,80221410;True;2
81211303;Films d'époque;Flower Crew: Joseon Marriage Agency;occ-0-2773-2774.1.nflxso.net/dnm/api/v6/6gmvu2hxdfnQ55LZZjyzYR4kzGk/AAAABYHCcIfEGjVnJirDrFwrzq3qOfvXIhAE7FNwCLspXgtWaJ92xgOBQzQRwTCDtLSo6KnrnY1UuaPAM9u2DppcjN29DF0KJI62MDo.webp?r=48d;2019;16 Épisodes;;13+;Un forgeron ordinaire devenu roi ne peut plus épouser son premier amour et demande à la meilleure agence matrimoniale de Joseon de transformer la roturière en noble dame.;;0;;Kim Min-jae,Gong Seung-yeon,Seo Ji-hoon,Park Ji-hoon,Byeon Woo-seok,Go Won-hee,Park Ho-san,Jung Jae-sung;;Coréen,Séries inspirées de livres,Séries comiques,Films d'époque,Séries comiques romantiques;Romantique;81610893,81211180,81642980,81517188,80178564,80986896,81267722,81482476,81609047,81279108,81260283,81682438,81033645,80196931,81211234,81211266,81669775,81509440,80093324,81093222,80031790,81430282,81649877,81422314,81116487,81463556;False;1
81211710;Séries SF et fantastique|Séries de SF et d'horreur;Bienvenidos a Edén;occ-0-2773-2774.1.nflxso.net/dnm/api/v6/6gmvu2hxdfnQ55LZZjyzYR4kzGk/AAAABTBRXr71kO51mrwYMOhxzpyNamsbaByM0CQmbngI2WMgV0yl1SmTTs4ZlZAQ2l6KE4sbjEEZ3hANL92wlcstJ-5bUSOQNFCYsjhhlcs-9UgJqXw6dwXIHH6ViNV8dhPy5OtD.jpg?r=729;2023;2 Saisons;;16+;Pour ce groupe de jeunes invités à une soirée sélecte sur une île lointaine, le paradis attendu se révèle un véritable enfer plein de mystères. Ils sont pris au piège.;violence, drogue;0;;Amaia Aberasturi,Berta Castañé,Begoña Vargas,Guillermo Pfening,Tomy Aguilera,Lola Rodríguez,Carlos Soroa,Diego Garisa,Sergio Momo,Nona Sobo,Irene Dev,Dariam Coco,Lucía Guerrero,Joan Pedrola,Max Sampietro,Jonathan Maravilla Alonso,Anna Alarcón,Albert Baró,Claudia Trujillo,Álex Pastrana,Amaia Salamanca,Belinda,Carlos Torres,Ana Wagener,Blanca Romero,Ana Mena,Berta Vázquez;;Espagnol,Séries SF;Suspense;81317562,81478642,81555635,81221380,81023636,81347771,81033361,81261170,80074220,81459931,81332635,81476183,81288983,80993062,81008221,80241318,80014749,80179190,81304948,81473355,81167761,80154610,81495803,81012637,81590491,80212986;True;2
81213803;Films et séries jeunesse;Les 7 vies de Léa;occ-0-2773-2774.1.nflxso.net/dnm/api/v6/6gmvu2hxdfnQ55LZZjyzYR4kzGk/AAAABSuBP6SQidfBIlDRoNkXH9GX7_2iSuOb0iJkEamMGEUWN0qWVy_NZCONThkUmg3_-GIZY9iJk21oUgMU2ShJJJgc56ZpXcEc0QOxhvDWkupWanU1DTfjjYayFVPWQf58bz1J.jpg?r=a16;2022;Mini-série;;16+;Après la découverte du squelette d'un jeune homme, Léa se réveille en 1991. Incarnée dans la peau de différentes personnes, elle tente d'empêcher cette mort mystérieuse.;sexe, langage grossier;0;;Raika Hazanavicius,Khalil Gharbia,Marguerite Thiam Donnadieu,Théo Fernandez,Maïra Schmitt,Rebecca Williams,Alexander Ferrario,Mélanie Doutey,Samuel Benchetrit,Anne Azoulay;;Français,Séries pour ados,Séries d'intrigue,Séries policières,Thrillers TV;Suspense;81213653,81444051,81211710,81446305,81046216,81037850,81001036,81481477,81459931,81324724,80241539,81342553,81612863,80244781,81314936,80241318,80211686,81258637,80179190,81304948,80233374,80222720,81577050,80220679,81295007,80212986;True;1
81214194;À regarder en un week-end;Mulligan;occ-0-2773-2774.1.nflxso.net/dnm/api/v6/6gmvu2hxdfnQ55LZZjyzYR4kzGk/AAAABTO-SdesXPAu5x-dpI9aEBm08zQKGR0ycQ2YGoAFGqoYGUv6O_QBJ9fTCoctmj6j0PoY3zU9-NdinLntf63wgJuAvEQ08HsAA52HIzkQHuxrBKbq09ZtGwwaBDsrkqj1Z7Dv.jpg?r=3ad;2023;10 Épisodes;;13+;Dans cette comédie satirique, la Terre a été détruite par des extraterrestres. Les survivants sauront-ils rebâtir un monde plus soudé sur les ruines de l'Amérique ?;;0;;Nat Faxon,Dana Carvey,Tina Fey,Phil LaMarr,Sam Richardson,Chrissy Teigen,Ronny Chieng,Rachel Dratch,Ayo Edebiri,Daniel Radcliffe,Kevin Michael Richardson,Toks Olagundoye;;Séries politiques,Séries comiques,Séries US;Décalé;81259476,80028732,70143830,80095697,81662953,80191522,81067223,80240585,70300800,81304528,70171942,81165134,80987903,70281562,81008138,81297404,80014749,80117038,80241499,81092963,80179190,80174479,80235932,80995819,81080959,81021929;True;1
81214609;Films et séries suédois;Complètement à cran;occ-0-2773-2774.1.nflxso.net/dnm/api/v6/6gmvu2hxdfnQ55LZZjyzYR4kzGk/AAAABWvcPzT8ZfKuzsD1YnHUJ0si7WzNGwRYlnSstw5kCpdtrHblFngQt-uLAOjVPWU9exGH3tqbHvwwFsKxU1u-_5zR0jKFpHFZRXggSJDVZhLBwrC2hekBZ27K3xi1ZZd3vWrA.jpg?r=b26;2021;Mini-série;;13+;Un braqueur de banque retient des otages dans un appartement ouvert aux visites avant de disparaître. D'abord déroutée, la police en vient à suspecter tout le monde.;;0;Felix Herngren;Dan Ekborg,Alfred Svensson,Marika Lagercrantz,Leif Andrée,Anna Granath,Per Andersson,Lottie Ejebrant,Carla Sehn,Petrina Solange,Sofia Ledarp,Sascha Zacharias;;Séries dramatiques,Suédois,Séries inspirées de livres,Séries d'intrigue,Séries policières;Sentimental;80153467,81015514,81128450,81394937,80141270,81011098,81043833,81330077,81019037,81580045,81233755,81288983,80211703,81641220,80241318,81069541,80157073,81473355,81113742,81580584,81164276,81150793,80243728,81414644,80241181,81039388;True;1
81218438;Téléréalité;La Brigade des délices;occ-0-2773-2774.1.nflxso.net/dnm/api/v6/6gmvu2hxdfnQ55LZZjyzYR4kzGk/AAAABfba_DdiMejAJGXCCOsRFG2i9SAv-U4dAPGPDvvyQHNdFIFuv9M5L87bTK_p-qHCfdydDzoTM6_kEhWJUh8LIgmU7Xi9SPBzNqWnJbIrU4-2xQMnDlRu9_XBCSLZEj2VFWZ9.jpg?r=d6d;2023;2 Saisons;;TOUS PUBLICS;Des pâtissiers experts élèvent le dessert au rang d'art avec des idées novatrices et un savoir-faire fabuleux. La compétition est lancée pour séduire les becs sucrés !;;0;;;;Séries pour la famille à voir ensemble,Émissions de cuisine et voyages,Téléréalité avec concours,Téléréalité,Séries US;Bonne humeur;81057855,81207686,80204927,81152744,81006858,81406124,80201328,81224668,81267200,81161673,80202234,81094767,81019894,81333845,81094391,81032737,80201866,81075536,81061828,81087405,81307101,81587446,81444148,81060954,81258641,80179138;True;1
81219804;Thrillers TV;Kings of Jo'Burg;occ-0-2773-2774.1.nflxso.net/dnm/api/v6/6gmvu2hxdfnQ55LZZjyzYR4kzGk/AAAABecz4q5Ig4GJ4MoVCbyWYEY9X32w0mWuHSjBdtZwjlMA6Bdr8D2G87jwuEShNwNYLjFsAkPTewcevS2eCx2-4X76bjJbHxOViO3qBrH4tjmZ1BDeg8_RRKJqHMe-i9gAXKOF.jpg?r=472;2023;2 Saisons;;16+;Les frères Masire règnent sur la pègre de Johannesburg, mais une malédiction familiale et un écheveau de trahison menacent de les détruire.;violence;0;;Zolisa Xaluva,Connie Ferguson,Cindy Mahlangu,Buhle Samuels,Thembi Seete,Thapelo Mokoena,Shona Ferguson,Tsholofelo Matshaba,Sello Sebotsane,TK Sebothoma,Lunathi Mampofu,Abdul Khoza;;Sud-africain,Thrillers TV,Séries fantastiques;Suspense;81317562,81444051,81282561,70140919,81388035,81035137,81597494,81294417,80217669,81116060,80207506,81354934,80176893,80097391,81488776,81287440,80241318,81175433,81282563,81553435,81338873,80113612,81630495,81044547,81151771,80241181;True;1
81220825;Films jeunesse et famille;La Petite Nemo et le Monde des rêves;occ-0-2773-2774.1.nflxso.net/dnm/api/v6/6gmvu2hxdfnQ55LZZjyzYR4kzGk/AAAABQB-AFwuRwHcYbblZxkEuumkxliX7Auu2cDWLz0rSW7G1B9tr2J2-jdbuqOotJAdwOft0kFwwcJy7TdVz6VyljIY5liwDt5NBZ4GNNPhrD3eNk_a4Hvny3SYUVGRiQWvFK59.jpg?r=73e;2022;2 h;;7+;Accompagnée d'un hors-la-loi extravagant, une jeune orpheline intrépide voyage dans le monde des rêves pour trouver une perle qui exaucera son vœu le plus cher.;;0;Francis Lawrence;Jason Momoa,Marlow Barkley,Chris O'Dowd,Kyle Chandler,Weruche Opia,Sylvie Jacob,Humberly González;David Guion,Michael Handelman;Films pour la famille,Films jeunesse et famille,Aventures en famille;;81028225,80992263,80232043,81517419,81012821,80002924,60027689,81050106,80993016,81026605,600346,81475311,81018682,81011712,70121502,70125931,81616116,70243449,60020686,80200487,60031264,70033005,80234520,81023618,70084792,81427442;True;1
81220971;Pour se détendre;Architecte du désir;occ-0-2773-2774.1.nflxso.net/dnm/api/v6/6gmvu2hxdfnQ55LZZjyzYR4kzGk/AAAABTZZmNPNwV-phRgmz2CGRAU4HJLR9bhDcCWSHs5xwZL4Hkd6mLTLf9-38hZ2bSDqYIcP9_v0rBTCkGGvOUnDTbu7dWO2m13VLjSMoLDVQ7XG85Ei1AndxdoPaYBCASuzIqhw.jpg?r=45d;2022;8 Épisodes;;13+;D'un donjon rock à un spa hors norme, l'architecte d'intérieur Melanie Rose imagine des rénovations érotiques pour les couples dans cette émission de téléréalité osée.;;0;;;;Téléréalité,Téléréalité maison et jardin,Séries US,Style de vie;Décalé,Intimiste;81094723,81437299,81057855,81497817,81459349,81275686,81026300,80209379,80215147,81196469,81292203,81060530,80184067,80160037,81088239,81032737,80241027,80223108,81075536,81307101,81587446,70187741,81016914,81598495,80244690,81175716;True;1
81221302;Séries policières;Il processo;occ-0-2773-2774.1.nflxso.net/dnm/api/v6/6gmvu2hxdfnQ55LZZjyzYR4kzGk/AAAABQmdE17SXcU8_bo6jtjmFarB9cxL84pHnvqcXQplMjrwLWBujNimtPMj3McPTM-EJoyTjvBrkwt2cgaFTrE3ojJTtUwsEuz6oIYfr7v-3fF_t9mvGJqg1mm6pIUE1LKIa7fF.jpg?r=7c4;2019;8 Épisodes;;13+;Le meurtre d'une adolescente touche une procureure liée à la victime, un avocat qui cherche à faire avancer sa carrière et une suspecte qui clame son innocence.;;0;Stefano Lodovichi;Vittoria Puccini,Francesco Scianna,Camilla Filippi,Simone Colombari,Maurizio Lastrico,Alessandro Averone,Euridice Axen,Marco Baliani,Pia Lanciotti,Giordano De Plano,Roberto Herlitzka,Tommaso Ragno,Margherita Caviezel,Anatole de Bodinat;;Séries dramatiques,Séries judiciaires,Italien,Séries policières;Cérébral,Sombre;80212986,81444051,81346339,81394937,81417796,81152788,81289581,81043833,81481477,80207506,81332635,80201500,81580045,81625074,81288983,81612863,80185171,81277858,80241318,81494917,81304948,80094728,81577050,81303831,81414644,80241181;True;2
81221380;Pépites pour vous|Séries d'action et d'aventure|Mondes épiques|Séries SF et fantastique|Tendances actuelles|Séries saluées par la critique;Sweet Tooth;occ-0-2773-2774.1.nflxso.net/dnm/api/v6/6gmvu2hxdfnQ55LZZjyzYR4kzGk/AAAABXGXuM8iznWP7gS_x1MFUmSZMP65OBsW7rpWx9Kmo8C1U1Dh8XPliZF9xX0Ugl1bHRWok4FXLU3715Z0nBe1aCE60JLzKApW8zsiCHmSBEkOt5GPbLQIR5IS5zoF8X2N57Nl.jpg?r=f34;2023;2 Saisons;;13+;Dans un monde post-apocalyptique, une adorable créature mi-cerf, mi-garçon part à l'aventure en quête d'une famille et d'un foyer, aux côtés d'un protecteur bourru.;;6;;Nonso Anozie,Christian Convery,Stefania LaVie Owen,Adeel Akhtar,Dania Ramirez,Aliza Vellani,Naledi Murray,Neil Sandilands,Marlon Williams,Yonas Kibreab,Christopher Sean Cooper Jr.,Amy Seimetz,Mia Artemis,Will Forte,James Brolin;;Séries d'action et d'aventure,Séries US,Séries fantastiques,Séries inspirées de B.D.;;80199393,80992263,80218885,80104198,81211710,80236319,81220825,81198448,81261170,80057918,70283264,80176893,81557402,81476183,81397077,80994340,81231974,80200487,80210920,80241239,80241318,80179190,80117803,81249833,80220679,80241181;True;6
81222923;Séries internationales|Séries dramatiques|À regarder en un week-end|Films d'époque;L'Impératrice;occ-0-2773-2774.1.nflxso.net/dnm/api/v6/6gmvu2hxdfnQ55LZZjyzYR4kzGk/AAAABaO-izQra6WjyEFU1WdyXjkgfRHrF64NXmushXozgk5q0fiwoXsbnIgR_gBGvzgYeKqUYPh0oX-LqvOR55FeMMa5MzK5vIRza8lzCeN2hL8hj-4HE3IXa3xIy-L_olJzqY1b.jpg?r=b04;2022;1 Saison;;13+;Quand la rebelle Élisabeth s'éprend de l'empereur François-Joseph et devient son épouse à la surprise générale, la cour de Vienne lui révèle un univers de pressions et d'intrigues.;;4;;Devrim Lingnau,Philip Froissant,Melika Foroutan,Johannes Nussbaum,Elisa Schlott,Jördis Triebel,Almila Bagriacik,Wiebke Puls;;Séries dramatiques romantiques,Séries politiques,Séries dramatiques,Allemand,Films d'époque;Émotion,Romantique;80992607,70213223,81476441,81410649,81564749,81324724,81580045,70285581,80232398,80136311,81476183,80182016,80070050,81498384,80179190,80211648,81354529,81140933,80025678,80213020,81590491,81267689,80119411,81414644,81041317,80212986;True;4
81226469;Films et séries jeunesse;Les Liaisons dangereuses;occ-0-2773-2774.1.nflxso.net/dnm/api/v6/6gmvu2hxdfnQ55LZZjyzYR4kzGk/AAAABctZTFLnt_bfC_Jc3sofn_2bhb4IDnJjlOxcVIL1tbx9euhYs59JR5Keokp-CT5pbBI2gskc970bgsh0WojeDgHLYp0lc4Bl5tktd60liCCjh3Ylmz7vN73BeVrgTFRRptqX.jpg?r=0f6;2022;1 h 49 min;;16+;Célène, ado romantique, tombe sous le charme du bad boy de son nouveau lycée à Biarritz sans savoir qu'il a fait un pari à ses dépens avec une redoutable influenceuse.;drogue, violence sexuelle;0;Rachel Suissa;Paola Locatelli,Simon Rérolle,Ella Pellegrini,Héloïse Janjaud,Jin Xuan Mao,Oscar Lesage,Alexis Michalik,Nicolas Berno;Rachel Suissa;Français,Drames,Films romantiques,Films inspirés de livres,Films pour ados;Romantique;81074938,81388078,81447264,80999729,80203147,81504320,80143556,81135138,81032078,81058435,81623358,81324724,81332722,81043665,81191429,81446038,81211017,81078393,81248121,80179190,81516659,81430236,81312536,81404946,81209537,80239639;True;1
81228573;Pépites pour vous|Anime;Komi cherche ses mots;occ-0-2773-2774.1.nflxso.net/dnm/api/v6/6gmvu2hxdfnQ55LZZjyzYR4kzGk/AAAABUjY9siTajqgR-wMcHsGmAJLrpyji4PXpEWtc_f6lGz_8uwG84aotEuLE_yjV8Dv4fzDW0VjX2J89MzA0NRKJpUtMDvIf8Lo-1vEKAnObJKIiNt5otxggyj5sdU--6sgFf7d.jpg?r=782;2021;24 Épisodes;;10+;Dans un lycée regorgeant de personnalités pour le moins originales, Tadano aide sa camarade Komi, timide et peu sociable, à atteindre son objectif : se faire 100 amis.;;0;;Aoi Koga,Gakuto Kajiwara,Rie Murakawa,Rina Hidaka,Rumi Okubo,Yukiyo Fujii,Ami Maeshima,Kenji Akabane,Yuga Sato,Kensho Ono,Sarah Emi Bridcutt,Junya Enoki,Maaya Uchida,Noriko Hidaka;;Japonais,Séries d'animation japonaise,Animes sur l'école,Séries inspirées de mangas;;80011358,80997338,81177634,81345945,80236253,70205014,70300472,80045948,81400497,81261669,81275353,80050063,81281872,81499847,81318888,81318842,80200989,80228274,81261630,80175351,80117781,80014749,81249833,81328781,81043571,81091393;True;2
81230204;Documentaires;La Reine Cléopâtre;occ-0-2773-2774.1.nflxso.net/dnm/api/v6/6gmvu2hxdfnQ55LZZjyzYR4kzGk/AAAABWTa0T6NQZw3iDGP7sQl7agYO59c2bBgSbdvJqiaPJ3tSxzzr_7Tk7Y6S8oQLgKbwTMOO38KXjw_nNDTIX1NI3UiCLMVAgf72nI7mNTp_47VZgljK8TbkAIlS6sTuUFnr4gA.jpg?r=c22;2023;4 Épisodes;;13+;Dernière pharaonne d'Égypte, Cléopâtre lutte pour défendre son trône, sa famille et son œuvre. Un docu-fiction fondé sur des reconstitutions et des témoignages d'experts.;;0;;Jada Pinkett Smith,Adele James,Craig Russell,John Partridge,Kaysha Woollery,Andira Crichlow,Greg Lockett,Philip Walker;;Séries dramatiques,Documentaires historiques,Séries documentaires,Docus société et culture,Docu-fictions;;81221380,81064069,81317673,81586873,80175352,80176893,70285581,80232398,81380540,81476183,81397077,80182016,80210920,81211003,80241318,80179190,80217818,80211648,81144910,80096545,81495803,81222923,81590491,18962448,81216491;True;2
81231181;Séries US|Documentaires;McGregor Forever;occ-0-2773-2774.1.nflxso.net/dnm/api/v6/6gmvu2hxdfnQ55LZZjyzYR4kzGk/AAAABa0QViDdHuGl4375nq0qTN-_N6l9GsxaIIEFFlCGXEUNcCjP8VQkblUeYfrEBudbQUGHqyv1GVZcX8IGchgM7NFiC0Zg7pYB_6McTkoMcBspBHjqGe2FEjo8cBBKDXwY8feG.jpg?r=b09;2023;Mini-série;;16+;Les frappes brutales de Conor McGregor et ses propos tapageurs ont fait de lui la plus grande attraction de l'UFC. Ce documentaire fascinant retrace sa carrière mouvementée.;violence;2;Gotham Chopra,Darragh McCarthy;Conor McGregor;;Séries documentaires,Séries US;;81386989,81452996,81463700,81288561,81500204,81317673,80203144,80187722,81130576,81586873,81380540,70267802,81410436,81153133,80217818,80204890,80049873,81005126,81157840,81311783,81062828,80164752,81569920,80202829,81580822,81046796;True;2
81231974;Pépites pour vous|Séries US|Séries SF et fantastique|Tendances actuelles|Seulement sur Netflix|Films et séries jeunesse|À regarder en un week-end|Séries à regarder sans modération;Mercredi;occ-0-2773-2774.1.nflxso.net/dnm/api/v6/6gmvu2hxdfnQ55LZZjyzYR4kzGk/AAAABbBkbHYNIGwgW5M7bRKf7EauEKZGuBes1Sz5LZJMwP_i7cUJJpsN2-74ci7BECUL3weLYsvcX5wtQq1ysGszB9xRn9ps9X56qH5H8Ose4ezkapyKeI9ntFtlY2BvSkEN5GXy.jpg?r=97c;2022;1 Saison;;13+;Brillante, sarcastique et un peu morte à l'intérieur, Mercredi Addams enquête sur une série de crimes tout en se faisant des amis (et des ennemis) à l'Académie Nevermore.;;9;;Jenna Ortega,Gwendoline Christie,Riki Lindhome,Christina Ricci,Jamie McShane,Hunter Doohan,Percy Hynes White,Emma Myers,Joy Sunday,Moosa Mostafa,Georgie Farmer,Naomi J. Ogawa,Catherine Zeta-Jones,Luis Guzmán;;Séries pour ados,Séries d'intrigue,Séries comiques,Séries US,Séries fantastiques;;80186863,80218885,81277950,80244781,81012366,81406219,80133311,80223989,80231433,80050008,81127150,81078393;True;9
81235000;Films et séries en français;Fary : Hexagone;occ-0-2773-2774.1.nflxso.net/dnm/api/v6/6gmvu2hxdfnQ55LZZjyzYR4kzGk/AAAABTWGUluDw-JyFs4J8hgKXZjI-nju-yAvZlWC9p07xTIkPEEQ3ZnoVQVME3WIdrkRlHJZtYgCeqZ4QHPr529HbZB0my31m_JJyMrYPgX-oryzlafyizuOfnnEQhlCJePK3LYf.jpg?r=840;2020;2 Saisons;;13+;Le phénoménal Fary s'attaque avec humour aux enjeux culturels, identitaires et patriotiques dans le premier volet d'un one-man-show en deux parties.;;0;Adrien Lagier,Ousmane Ly;Fary;;Français,Séries comiques,Stand-up;;81520506,80133335,80174687,81270678,81233911,81600435,80213024,81096745,81191429,80170187,81410558,81209142,80124680,81453268,81467328,81010818,80014749,80987464,80225917,81008236,81470399,81416977,81654760,81587697,81290742;True;1
81236338;Anime;Baki Hanma;occ-0-2773-2774.1.nflxso.net/dnm/api/v6/6gmvu2hxdfnQ55LZZjyzYR4kzGk/AAAABeqUxIhH7j2ZEb8s2611CJWnmIdGjz3HcMdk2kshr0E8xoYEkzBY9s5W9oJMH9r_QBHNF7qDPV40insKt0nj9Ra3mkmp5o7-PUvpZi6you36JiMm4kwVPgNth57BRCYLYutz.jpg?r=a08;2021;1 Saison;;16+;"Afin d'acquérir les compétences nécessaires pour surpasser son père, Baki intègre la prison d'État d'Arizona pour affronter un prisonnier, le redoutable ""M. Unchained"".";violence;1;;Nobunaga Shimazaki,Akio Otsuka,Hochu Otsuka,Kenji Nojima,Mami Koyama,Takaya Hashi,Megumi Han,Tessho Genda,Yasuhiro Mamiya,Koichi Yamadera,Kensho Ono,Ryoichi Tanaka,Tomohisa Aso,Taiten Kusunoki,Toru Okawa,Jiro Saito,Masashi Ebara,Toru Furuya;;Anime d'action,Japonais,Séries d'animation japonaise,Anime sportifs,Séries inspirées de mangas;;80000603,81281582,70205012,80992228,81444051,81177634,80243876,80191008,70266998,70300472,80045948,81002441,80179831,80050063,81281579,81186862,70299043,81030627,81054853,81249833,80095241,80995578,80023687,81001988,81091393;True;1
81237994;Séries internationales|Séries de SF et d'horreur|Séries à regarder sans modération|Tendances actuelles|Films et séries jeunesse|Seulement sur Netflix|Séries saluées par la critique;All of Us Are Dead;occ-0-2773-2774.1.nflxso.net/dnm/api/v6/6gmvu2hxdfnQ55LZZjyzYR4kzGk/AAAABTw-IchmBhH_bCXVZIQYwI19nnd0NQBDxJFQmTokzIUwS6d52SgxrRHD-nT92qjDvCzRxinykvfNeV_oJ4ttAo4rB5df1SAG65L3jhCbMn0lt4iFD7gZ-T-Hncx159z0Lu9y.jpg?r=48d;2022;1 Saison;;16+;Un lycée devient l'épicentre d'une épidémie liée à un virus zombie. Pris au piège, les élèves devront lutter pour s'échapper ou risquer d'être à leur tour contaminés.;violence;7;;Park Ji-hu,Yoon Chan-young,Cho Yi-hyun,Lomon,Yoo In-soo,Lee You-mi,Kim Byong-chul,Lee Kyoo-hyung,Jeon Bae-soo;;Coréen,Séries pour ados,Dramas coréens inspirés de webtoons,Séries d'épouvante;;81312457,81003028,81240831,80241947,81444051,80197462,80198988,80119177,70177057,80161216,81486809,81307048,81021447,80180171,81081050,80008434,81046394,80241318,81519223,80179190,81040344,80208806,80990668,81256675,80057281,81061734;True;7
81239779;Pépites pour vous|Drames;7. Koğuştaki Mucize;occ-0-2773-2774.1.nflxso.net/dnm/api/v6/6gmvu2hxdfnQ55LZZjyzYR4kzGk/AAAABexamysO-V-kLGrdWSAzMujKMwQK_7P_v-Hp9z0cMKD8jwJ1HIrc8H7LpFvFJsWZ4bhO-iFNwBNkglz_kK0krWqEWsdGoH2TceA.webp?r=1dc;2019;2 h 12 min;;13+;Séparé de sa fille, un père avec un handicap mental doit prouver son innocence lorsqu'il est arrêté pour le meurtre d'une enfant.;;0;Mehmet Ada Öztekin;Aras Bulut İynemli,Nisa Sofiya Aksongur,Deniz Baysal,Celile Toyon,İlker Aksum,Mesut Akusta;Özge Efendioglu,Kubilay Tat;Turc,Drames,Drames sociaux;Émotion;81129849,81298682,80066891,80081151,81248111,81346323,81135138,70114497,80207506,81349306,80134420,80176893,81043665,70044605,81350683,81669775,80073823,80200047,80179190,81334946,81076535,60000417,81577050,80128245,81435227,81408600;False;2
81243961;Documentaires;Notre univers;occ-0-2773-2774.1.nflxso.net/dnm/api/v6/6gmvu2hxdfnQ55LZZjyzYR4kzGk/AAAABR5_2qbYZAvo0kl5ALmj_ca7c01x4vaFMuJGOM_4ROSYcz_Y1y6fIE2X4GPG6eQKYIHUK76QxkCsQ9QkEMpWRjt_zvccXs95WAJ6bsPYd48ZexbS3gd4BB0mP_pLCiAXIwEJ.jpg?r=21d;2022;6 Épisodes;;7+;Cette série documentaire explore l'incroyable histoire de notre univers sur des milliards d'années et son influence inextricable sur la vie terrestre.;;0;;Morgan Freeman;;Séries pour la famille à voir ensemble,Britannique,Documentaires nature et écologie,Émissions sciences et nature,Docus sciences et nature;Cérébral;81036559,81328829,81111324,81273453,81064069,81346975,81353947,81341781,81410405,81554159,81343342,81018709,81086133,80218938,81447086,70267802,81211003,81276049,81170676,81311783,81471470,81183477,81145024,80221410;True;1
81245455;Mondes épiques;Troll;occ-0-2773-2774.1.nflxso.net/dnm/api/v6/6gmvu2hxdfnQ55LZZjyzYR4kzGk/AAAABZlvCRQP14JkJJV5wcn2uiurtZCePeTRiQINc4S3C_kn6S9tyVkR5eEHxhkvdaezD8fNwEVZg2EJ2TWdEL73fYTdVepJgcHCk8yeXX1WAI6VYUUZX2KsBtnwTwydStTXqFcO.jpg?r=87c;2022;1 h 43 min;;13+;Lorsqu'une explosion dans une montagne en Norvège réveille un ancien troll, les autorités font appel à une paléontologue intrépide pour l'empêcher de semer le chaos.;;0;Roar Uthaug;Ine Marie Wilmann,Kim Falck,Mads Sjøgård Pettersen,Gard B. Eidsvold,Karoline Viktoria Sletteng Garvang,Yusuf Toosh Ibra,Bjarne Hjelde,Anneke von der Lippe,Dennis Storhøi,Fridtjov Såheim;Roar Uthaug,Espen Aukan;Norvégien,Films d'action;Suspense;81044417,80133543,80218885,80017529,81220825,81161789,80218455,70305899,81458368,81473627,80993105,70056430,81165134,81171201,70119441,81004278,81231974,80200487,80237937,80093133,80067831,80187362,80119234,81186049,80161352,80216309;True;2
