ID;categorie;titres;liens_images;année;durée;score_recommendation;age_conseillé;description;prévention;mise_en_avant_supplémentaire;réalisation;distribution;scénariste;genres;avertissement_programme;recommendations;netflix_original;nombre_occurrence
80241472;Séries de SF et d'horreur;Alma;occ-0-2773-2774.1.nflxso.net/dnm/api/v6/6gmvu2hxdfnQ55LZZjyzYR4kzGk/AAAABQ8QvzyQWVZbJA_un4ZkiV0AF7oF26rxahmgMNF0hSW8qAh_T2NRgXI0NGpAT80eR9v7pG8bIXZ5K934Z0yXCJJrmmAmap_FXWaVetKSy4REveB_ksXyH9wJSNkg30LzJjAP.jpg?r=873;2022;9 Épisodes;;16+;Après avoir perdu la mémoire dans un étrange accident où presque tous ses camarades ont péri, Alma tente de comprendre ce qui s'est passé et de retrouver son identité.;violence sexuelle, suicide;0;;Mireia Oriol,Álex Villazán,Pol Monen,Javier Morgade,Nil Cardoner,María Caballero,Claudia Roset,Milena Smit,Marta Belaustegui,Josean Bengoetxea,Kandido Uranga,Nacho Fresneda,Alejandro Serrano,Elena Irureta,Katia Borlado;;Espagnol,Séries pour ados,Séries d'épouvante;À énigmes,Suspense;81483306,81213653,81045829,81211710,80236319,80222802,81046216,80241181,81037850,81213803,81324724,81150303,80241539,81397077,81612863,80209229,81216677,81112336,80241318,81258637,80179190,81304948,81495803,81059720,81498294,80212986;True;1
80241499;Animation pour adultes|À regarder en un week-end;Close Enough;occ-0-2773-2774.1.nflxso.net/dnm/api/v6/6gmvu2hxdfnQ55LZZjyzYR4kzGk/AAAABSD4Ka0s35y_s_xgJD216T53ocF4Tx2pXtQbCZH_Z6AH94UzqRyFtKEliZef9WRDPftvILhZ_5nClugUcvAECYW2T03Xc0SarnY.webp?r=f27;2021;2 Saisons;;13+;Dans cette série animée pour adultes, un couple de millennials essaie de rester cool quand les responsabilités familiales remplacent l'insouciance de leurs 20 ans.;;0;;J.G. Quintel,Gabrielle Walsh,Jason Mantzoukas,Kimiko Glenn,Jessica DiCicco,James Adomian,Danielle Brooks;;Séries comiques,Séries US;Insolite,Décalé;80028732,81259476,81053303,70143830,81214194,80103408,80095697,80191522,81067223,81304528,70300800,81165134,70123711,80987903,70281562,70153404,81008138,80014749,80117038,80179190,81092963,80198137,80174479,80235932,80995819,70136120,81080959;False;2
80241539;Films et séries jeunesse;Mortel;occ-0-2773-2774.1.nflxso.net/dnm/api/v6/6gmvu2hxdfnQ55LZZjyzYR4kzGk/AAAABR5NbWSewf6zVNuPDk8Qz0wym-8vtDQBF2ypXT7JIs_4CyvOxQPRgSx2YMKWkRmE4J0ruVwlk3sNQ3SpCewoG5ecBqs0L7sLP18pgCRv3DnfemRza8D6Y562ak90ZDdHEsGk.jpg?r=31f;2021;2 Saisons;;16+;Après avoir conclu un marché avec un être surnaturel, deux lycéens doivent unir les super-pouvoirs qu'ils viennent d'acquérir pour retrouver un assassin.;violence, automutilation;0;;Carl Malapa,Némo Schiffman,Manon Bresch,Corentin Fila,Sami Outalbali,Anaïs Thomas,Firmine Richard,Léa Léviant,Marvin Dubart,Stéphane Brel;;Français,Séries pour ados,Séries fantastiques;Suspense;81213653,81444051,81211710,80221644,81037850,81481477,80133311,81459931,80057918,81213803,81324724,81150303,81342553,80241239,80241318,81258637,80084447,80179190,81304948,80222720,81059382,81495803,80220679,80223989,80238357,80212986;True;1
80242342;Pépites pour vous|Drames;Le Haut du panier;occ-0-2773-2774.1.nflxso.net/dnm/api/v6/6gmvu2hxdfnQ55LZZjyzYR4kzGk/AAAABYdJKJ6Ie2VOtRi11JF42TUNwFl4uEp7qu-Eq_JLtnLtDAmHUoCizVyM254q46PGn71Lk6JfjIz18P40ldDmu2ekciHD6ejXTZld-jO-dx9gtWlfDAgN03dKBeHYIQVXTNM8.jpg?r=93c;2022;1 h 58 min;;10+;Lorsqu'un recruteur de basket en perte de vitesse repère une potentielle superstar en Espagne, il compte bien prouver qu'ils peuvent tous deux réussir en NBA.;;0;Jeremiah Zagar;Adam Sandler,Juancho Hernangómez,Queen Latifah,Ben Foster,Kenny Smith,Robert Duvall,Jordan Elizabeth Hull,María Botto,Heidi Gardner,Ainhoa Pillet,Anthony Edwards;Taylor Materne,Will Fetters;Drames,Comédies;;80096984,80063265,80245104,80999009,81161828,70125231,60024922,70220030,80990663,80216302,70041162,70119811,80207506,70208247,81212842,81165134,81414099,80037476,80183328,80014749,70201437,81251628,70021637,80058397,80242619,70087541;True;2
80242619;Films d'action et d'aventure|Blockbusters|Films comiques;Murder Mystery;occ-0-2773-2774.1.nflxso.net/dnm/api/v6/6gmvu2hxdfnQ55LZZjyzYR4kzGk/AAAABeyxcbh_CKut2QpIvks5Y_MZjeUDxvjyI5RixXFUYK-_flVOXVbQJbWWo2wKBscEFF8UmAg57NN5pYAXo4btlPFFRbgd0RaN3ow1nzpbdxnzXXlq03VPTuzYljesGLbC37cK.jpg?r=f16;2019;1 h 38 min;;13+;Lors d'un voyage tant attendu en Europe, un policier new-yorkais et sa femme se démènent pour résoudre un meurtre inexplicable survenu à bord du yacht d'un milliardaire.;;0;Kyle Newacheck;Adam Sandler,Jennifer Aniston,Luke Evans,Gemma Arterton,Adeel Akhtar,Luis Gerardo Méndez,Dany Boon,Terence Stamp;James Vanderbilt;Films comiques,Intrigues,Films d'action;Décalé;80063265,80245104,81018383,70125231,80158583,70220030,70267242,81161626,70041162,70208247,81165134,70113002,81450827,80200487,70153404,81030627,80037476,80183328,80242342,81251628,80094318,70270408,70021637,70087541,81458416;True;3
80242724;Séries SF et fantastique|Séries d'action et d'aventure|Mondes épiques;Warrior Nun;occ-0-2773-2774.1.nflxso.net/dnm/api/v6/6gmvu2hxdfnQ55LZZjyzYR4kzGk/AAAABdCvP_R_Bq2yS3zW2ehwwmyKvHxs-Ud-IKJRxbouyviZH4_ObBEPRCejN3iG2y0j-OGbUEwIdXzibWBML2vc1477iZibqk14oAsLEbdxYtmC6cxncR2sbLlubR_eNSHUhxpe.jpg?r=763;2022;2 Saisons;;16+;Une ado orpheline se réveille à la morgue et découvre ses nouveaux superpouvoirs : elle est porteuse du Halo d'une société secrète de religieuses chasseuses de démons.;violence;0;;Alba Baptista,Thekla Reuten,Lorena Andrea,Toya Turner,Kristina Tonteri-Young,Tristán Ulloa,Sylvia De Fanti,William Miller;;Séries pour ados,Séries d'action et d'aventure,Séries US,Séries fantastiques,Séries inspirées de B.D.;Suspense;80199393,81252707,80218885,80189685,81213653,81444051,80236319,80221644,80057918,81165134,81150303,80230293,81279312,81397077,81231974,80200487,80241239,81258637,80084447,81582615,80186863,80220679,80223989,81509213,80238357,81108579;True;5
80242926;Films jeunesse et famille;La Princesse de Chicago;occ-0-2773-2774.1.nflxso.net/dnm/api/v6/6gmvu2hxdfnQ55LZZjyzYR4kzGk/AAAABQWGj0tcs5HtNdDVDf60OnOzschudzDVu3YXTzttb-FLFpY5D5S6NuMZqp74hdZtGHr_ahcf3wbQM_10n3lvHUB8UO-1di7PEly9nHCJt-X9E8nhTNJYRvJNjEK4GNAT6qPW.jpg?r=157;2018;1 h 42 min;;TOUS PUBLICS;En découvrant qu'elles se ressemblent comme deux gouttes d'eau, une pâtissière terre à terre et une future princesse élaborent un plan pour échanger leurs rôles.;;0;Mike Rohl;Vanessa Hudgens,Sam Palladio,Nick Sagar,Suanne Braun,Mark Fleischmann,Amy Griffiths,Sara Stewart,Pavel Douglas,Robin Soans,Calliope Taylor,Natali Yura,Alexa Adeosun;Robin Bernheim Burger,Megan Metzger;Films pour la famille,Films jeunesse et famille,Drames pour la famille,Drames,Films romantiques;Attachant,Romantique;80994878,81132044,81148811,81026188,60033327,81029841,80160759,80999781,80245601,81183451,80242446,81194110,81088159,81416312,81002412,81228331,80179190,81609503,80187107,81056195,80238204,81209537,80177441,81034553;True;1
80243728;Séries policières|Thrillers TV;Deadwind;occ-0-2773-2774.1.nflxso.net/dnm/api/v6/6gmvu2hxdfnQ55LZZjyzYR4kzGk/AAAABUU-OHwtTQ2emKJo7qan4TWOqnOGxk8yalPlkYv5R4qB3uxK1COoiLGL6FWtIRu_LW4z9URvWogmS7MMW_Qc_L8IQmNhSZqS26U.webp?r=772;2021;3 Saisons;;16+;Quelques mois à peine après avoir perdu un être cher, l'inspectrice Sofia Karppi enquête sur le meurtre d'une femme liée à une entreprise en bâtiment d'Helsinki.;violence;0;;Pihla Viitala,Lauri Tilkanen,Mimosa Willamo,Jani Volanen,Tommi Korpela,Pirjo Lonka,Riku Nieminen,Pamela Tola,Jonna Järnefelt,Raimo Grönberg;;Finlandais,Séries d'intrigue,Séries policières,Séries scandinaves,Thrillers TV;Cérébral,Sombre;80240691,81304572,81394937,80123729,81318520,81332052,81481808,81370440,81027195,81043833,81011098,81054831,81481477,80201500,81557402,81288983,81397077,81612863,80211703,81641220,81277858,80241318,81239598,81079046,81495803,81039388;False;2
80243876;Anime;ベルセルク;occ-0-2773-2774.1.nflxso.net/dnm/api/v6/6gmvu2hxdfnQ55LZZjyzYR4kzGk/AAAABTCg0834_eedr95PVwcG1Xrug5J6FGXr5P7oy3Bab6VqIBTmnJ43Ii-2q9DXl7HhKe-S4OAnFDnthkXA9f8RVtXehffUkKwOCzc.webp?r=9fb;1997;25 Épisodes;;18+;Au cœur d'un univers médiéval, un mercenaire errant rejoint un chef charismatique dans sa quête impitoyable de gloire et de reconnaissance.;violence, violence sexuelle;0;;Nobutoshi Canna,Toshiyuki Morikawa,Yuko Miyamura,Akira Ishida,Tomohiro Nishimura,Akiko Yajima,Masuo Amada,Yuri Shiratori,Tessho Genda,Tamio Oki,Masahito Kawanago,Mahito Tsujimura,Toru Okawa,Toshiko Sawada,Naoki Bando,Minoru Inaba;;Anime SF et fantastique,Anime d'action,Japonais,Séries d'animation japonaise,Séries inspirées de mangas;Violent;80146298,81281582,60021103,81177634,80191008,81033445,80200575,70300472,80174974,81409869,80179831,81281579,81499847,70202899,80001305,70204964,80200989,70299043,70308852,81054853,81302750,81249833,80095241,81183924,80204451,80995578;False;1
80244283;Séries SF et fantastique;Maya, princesse guerrière;occ-0-2773-2774.1.nflxso.net/dnm/api/v6/6gmvu2hxdfnQ55LZZjyzYR4kzGk/AAAABdI7dnh8PlSU7QWObIvM6x_i7sUiuV558c8wqNPD7UAOlg1ItugMAnZDTG8fsvUfcvzAqBmxjdM6e-lMe1MxMgCUW3DptE5ZNaMi86Y0rZD9MnoRkX6Ve_mbJvFm42Qp0QEj.jpg?r=564;2021;Mini-série;;10+;Une fougueuse princesse guerrière tente d'accomplir une ancienne prophétie pour épargner à l'humanité la colère de dieux vengeurs.;;0;;Zoe Saldaña,Gabriel Iglesias,Diego Luna,Gael García Bernal,Rita Moreno,Alfred Molina,Allen Maldonado,Stephanie Beatriz,Kate del Castillo,Danny Trejo,Cheech Marin,Rosie Perez,Queen Latifah,Wyclef Jean,Isabela Merced,Chelsea Rendon,Joaquín Cosío,Carlos Alazraqui,Eric Bauza,Sandra Equihua;;Pour enfants,Séries pour la famille à voir ensemble,Dessins animés,Séries fantastiques;;80239482,80212245,80103408,81026605,81035568,81199052,81475311,81018682,81153694,80057250,81093076,80988892,80214236,81076952,80075820,81616116,70243449,80218108,80200487,60031264,80234642,81399614,81145135,81010139,81267965,80147919;True;1
80244479;Documentaires;Colin en noir et blanc;occ-0-2773-2774.1.nflxso.net/dnm/api/v6/6gmvu2hxdfnQ55LZZjyzYR4kzGk/AAAABdG77djuDwCUnShQf9WlE_Ffp22LZO1F5oUwkdgs0Se34gdHojHjhJSxFaurDd85-G0htWD6Y5AQXcttV_phepNRLJbW2kFpBtTe_Z9N1KLe5Mzda0Vfomf027DoKQCBszZ9.jpg?r=0f8;2021;Mini-série;;13+;Dans cette série, Colin Kaepernick raconte sa quête d'excellence malgré les obstacles que constituent les différences de couleur, de classe et de culture.;;0;;Colin Kaepernick,Jaden Michael,Nick Offerman,Mary-Louise Parker,Mace Coronel,Klarke Pipkin,Amarr M. Wooten;;Séries dramatiques,Séries pour ados,Séries US,Docu-fictions;Émotion;80202462,80096984,81452996,328438,81046613,80226923,81147766,80203144,80216302,80091742,70119811,80207506,80176893,80097391,80074781,60020749,80211686,81282563,80179190,80242342,80117809,80117458,81435227,80200549,81121351,80241181;True;1
80244565;Séries US|Téléréalité;Indian Matchmaking;occ-0-2773-2774.1.nflxso.net/dnm/api/v6/6gmvu2hxdfnQ55LZZjyzYR4kzGk/AAAABcmJR-YjcBoyRBiEGh9fHptM3bNThdO703qWrD4qzp_O-VmYLbvKAbCd7Xq10dZLQmuUZ6Bc9_LT1SHdRzMucp0MtvMMl0px_fTY7qHoT5uP3lKFrTKn8Tc6Ny1-faXcxN4y.jpg?r=d9a;2023;3 Saisons;;7+;La marieuse Sima Taparia aide ses clients du monde entier à arranger leur mariage, conformément à une tradition qui prend aujourd'hui de nouvelles formes.;;0;;;;Téléréalité romance et mariage,Téléréalité,Séries US;Intimiste;81057855,81631016,81109061,81350804,81275686,81026300,81161576,81292203,80996601,81521365,81175724,70217931,81411891,81032737,81462121,81505384,80223108,81310218,81127121,81417598,80204889,81014405,81598495,81456532,81180964;True;2
80986854;Pour se détendre;I Think You Should Leave with Tim Robinson;occ-0-2773-2774.1.nflxso.net/dnm/api/v6/6gmvu2hxdfnQ55LZZjyzYR4kzGk/AAAABe0fIrK8zc-RA7r_mWH9bqWGW9uFggIm3cpy2sXnaEpRKucyDx8qjbGlTFnOUFyzIsQF8yVCIxo-Jd2H7TlEgK2Co9-cNpAxMbrv1FoP2x_0iH2fW0NQXNZw57pCvWlH5eR0qZxq4_phZsa5yGYqwTjIbnWkHNEdy2hRd6jERFftAHRIKveeCuxC0KuQm03nWkPuU1IfWML8NPShsk47q8VHDi4lvMg_QXXR2SQ0H6w-L_2LXioJkKbNzus648wQcVy44euu0Hjq08WagDKKKrUWUW3t9StEJHovb6R9-9MhdQ2Dfbj7dkj5hA.jpg?r=aa7;2023;3 Saisons;;16+;Cette série comique à sketchs présente une liste impressionnante de guest-stars dans un festival de situations décalées.;;1;;Tim Robinson,Andy Samberg,Sam Richardson,Will Forte,Fred Willard,Cecily Strong,Tim Heidecker,Kate Berlant,Patti Harrison,Conner O'Malley;;Séries comiques,Séries US;Absurde,Insolite;80049065,81193104,81214194,70140358,80243600,70218756,81009617,80198950,70300800,70171942,81087498,81397077,80073289,70281562,70153404,81619082,80014749,70153385,80179190,81092963,70270408,70155589,70136120,70153373,81516751,81447461;True;1
80986896;Films d'époque;Love in the Moonlight;occ-0-2773-2774.1.nflxso.net/dnm/api/v6/6gmvu2hxdfnQ55LZZjyzYR4kzGk/AAAABdY6EfQouAME1c-lxx1yTjKVX74Juahzpiy3GD9zFLFtFiBbfrJSX2XpKXqhkBksSQrnk7QQn4ojWXXiGn3JTgUl6lCAxRev9Fs.webp?r=ff3;2016;18 Épisodes;;13+;En Corée, sous la dynastie Joseon, une jeune femme qui a vécu jusque-là dans la peau d'un homme devient eunuque au palais royal et noue des liens avec le prince.;;0;;Park Bo-gum,Kim You-jung,Jinyoung,Chae Soo-bin,Kwak Dong-yeon,Cheon Ho-jin,Han Soo-yeon,Kim Seung-soo,Jeon Mi-seon,Jung Hye-sung,Jang Kwang,Lee Jun-hyeok,Tae Hang-ho,An Nae-sang;;Séries politiques,Coréen,Séries comiques,Films d'époque,Séries comiques romantiques;Attachant,Romantique;81610893,81482494,81517188,80178564,81444051,81267722,81482476,81279108,81260283,81682438,81033645,80196931,81465196,81211303,81669775,80188354,81509440,80093324,81472752,81093222,80031790,81430282,81649877,81422314,81116487,81463556;False;1
80987064;Animation pour adultes;Resident Evil: Infinite Darkness;occ-0-2773-2774.1.nflxso.net/dnm/api/v6/6gmvu2hxdfnQ55LZZjyzYR4kzGk/AAAABclQT0DN7uEL4hw7PdZAblBrNeSr5mBNjgGguskNL6mzEbWq4-8LVgEMw2Iy7G_lSo8y95QRrHOv1suzvkiZrbME6idLqVJrVBZg6V8CgvyNkCp4quLCYkLaqVC8rWAXpiZL.jpg?r=338;2021;4 Épisodes;;16+;Des années après les événements de Raccoon City, Leon et Claire font face à une sombre conspiration quand une attaque virale fait des ravages à la Maison-Blanche.;violence;0;;Nick Apostolides,Stephanie Panisello,Ray Chase,Jona Xiao,Billy Kametz,Joe J. Thomas,Doug Stone,Brad Venable,Toshiyuki Morikawa,Yuhko Kaida,Fumihiko Tachiki,Megumi Han,Kenji Nojima,Kazuhiko Inoue,Aruno Tahara,Mitsuru Ogata;;Anime d'action,Anime inspiré d'un jeu vidéo,Séries d'animation japonaise,Anime d'horreur,Séries US;Suspense;81240831,81444051,80198988,81418302,81435684,81037868,81237994,80119177,70177057,70056430,81483047,80115466,80008434,80174608,80237937,81046394,81001991,80208806,81249833,80095241,80098202,81295011,81186049,80996532,80149259,81091393;True;1
80987903;Animation pour adultes;The Midnight Gospel;occ-0-2773-2774.1.nflxso.net/dnm/api/v6/6gmvu2hxdfnQ55LZZjyzYR4kzGk/AAAABXkpEemKDoatoKVFYy9hRjPT0IyBeq2ZhruPyTKFte3XkzNw6laYZ1GwsHTeXb26J7mxP9pHZ3a8X8YQuTafOQFgEN9ZLNg8Tbu1ER_T78NNyY0xp9QF6xpsR-J0SClzO3Nn.jpg?r=8b0;2020;8 Épisodes;;16+;Grâce à son simulateur d'univers, un spacecasteur explore des mondes trippants et des questions existentielles sur la vie, la mort... et tout le reste !;violence;0;;Duncan Trussell,Phil Hendrie,Drew Pinsky,Joey Diaz,Natasha Leggero,Johnny Pemberton,Christina Pazsitzky,Anne Lamott,Damien Echols,Trudy Goodman,Maria Bamford,Pauly Shore,Doug Lussenhop,David Nichtern,Steve Little,Caitlin Doughty,Stephen Root;;Séries comiques,Séries US;À énigmes,Insolite,Cérébral;80028732,81259476,81053303,81214194,80095697,81662953,80191522,81178338,81067223,81304528,70300800,81165134,70281562,81008138,80014749,80117038,80241499,81092963,80179190,80198137,80174479,80235932,80995819,70136120,81080959,81245457;True;1
80988262;Films jeunesse et famille;Des pom-pom girls en or;occ-0-2773-2774.1.nflxso.net/dnm/api/v6/6gmvu2hxdfnQ55LZZjyzYR4kzGk/AAAABR1B4bMdaf6GEJxxR7c68RmSNQeRI6HEfaivLxr17dl9NF5lT6y5N5goACaDH0tpux00fEJYQq1NgKHR2GrHxB7NVBIwMkzQIxs.webp?r=f02;2018;1 h 28 min;;7+;Après avoir déménagé en Australie, une adolescente américaine persuade ses nouvelles amies de monter une équipe de chearleaders et d'affronter leurs grandes rivales.;;0;Clay Glen;Kelli Berglund,Emily Morris,Terry Rogers,Jess Kuss,Jo Stone,Elysia Markou,Daisy Anderson,Ruth Natalie Fallon,Henry Turczynowicz,Martha Lott;Clay Glen;Films pour la famille,Films jeunesse et famille,Australien,Drames pour la famille,Drames;;81422413,70180051,80994878,81252928,80095435,81289456,81029841,80243706,80020037,80220644,81002685,80994277,81001036,81032078,81504820,80134695,81262270,81005407,80996811,80179190,80242926,80187107,81568357,81283585,81068916,80222177;False;1
80989772;Documentaires;Le Parcours des tyrans;occ-0-2773-2774.1.nflxso.net/dnm/api/v6/6gmvu2hxdfnQ55LZZjyzYR4kzGk/AAAABVs9B_Kl17nUxZWGLXVAlIWZ-3NrH2WSNI_AKz3TeZbpdPmj6DyX1oLkMNAEAW8GcnygSrYbAMwAEvg2822i0Mrohwc4OyIvXwYRsRTIxwn994y3m7h7dzc_bdHuUjbuUyCj.jpg?r=8e5;2021;6 Épisodes;;16+;Pour diriger d'une main de fer, tout aspirant dictateur doit suivre l'exemple des despotes présentés dans ce docu-série et appliquer le guide du pouvoir totalitaire.;violence, images choquantes;0;;Peter Dinklage;;Séries politiques,Documentaires politiques,Documentaires sur l'armée,Séries documentaires,Séries US;Sombre;80109535,81013210,80237990,80106791,81317673,80990771,81469002,81116168,81018709,80208082,21477429,81227142,81211003,81315804,81153133,80211648,80989924,81035118,81014547,80096545,81488464,81316863,80208211,80138915,81467138,80134093;True;1
80989924;Documentaires|À regarder en un week-end;Les grandes dates de la Seconde Guerre mondiale en couleur;occ-0-2773-2774.1.nflxso.net/dnm/api/v6/6gmvu2hxdfnQ55LZZjyzYR4kzGk/AAAABU1duBxeSRimtCI5qQ0iuusTjBH54M3gxfodlsHGtwPQJP1E4oLZMm2fFLt_x2DwSaNTP72wQqIv4m8Y6bH3-5oushkT9bkOnsQ.webp?r=62e;2019;10 Épisodes;;13+;De Pearl Harbor au débarquement, les événements les plus cruciaux de la Seconde Guerre mondiale prennent vie dans ce docu-série frappant présentant des images colorisées.;;0;;;;Séries politiques,Britannique,Documentaires historiques,Documentaires politiques,Documentaires sur l'armée;;81422962,81243961,80237990,80106791,80989772,81317673,80169786,81469002,81471385,81471442,80208082,21477429,81466189,81227142,81211003,81153133,80208213,80211648,81014547,80096545,81488464,81316863,80208211,80138915,81467138,80134093;False;2
80990771;Documentaires|À regarder en un week-end;L'essor de l'Empire ottoman;occ-0-2773-2774.1.nflxso.net/dnm/api/v6/6gmvu2hxdfnQ55LZZjyzYR4kzGk/AAAABeH6_IX7CHpdwsZ131ixVdH34pn8QmFOhivqqLR9tvglCSTp0Flk_g4kxpn-7yAkb7GR2O3M0EU1EfoReqVwNftm1F7so3_rkGf8AgFg8JzcnDM-AnOYwiVv7ILE8Urja-uI.jpg?r=2ac;2022;2 Saisons;;16+;Le sultan ottoman Mehmed II mène une campagne épique pour s'emparer de la capitale byzantine de Constantinople et façonne le cours de l'Histoire pour les siècles à venir.;violence;0;;Charles Dance,Cem Yiğit Üzümoğlu,Daniel Nuță,Ali Gözüşirin,Nik Xhelilaj,Radu Andrei Micu,Tuba Büyüküstün,Tommaso Basili,Selim Bayraktar,Birkan Sokullu,Osman Sonant,Tolga Tekin,Damla Sönmez,Ushan Çakır,İlayda Akdoğan;;Turc,Documentaires historiques,Séries d'action et d'aventure,Documentaires sur l'armée,Séries documentaires;;81471290,81466297,70305883,80189685,80074249,80123615,80237990,80083594,80989772,70305899,80161728,81417796,70056440,80175352,81279312,80182016,70301870,81211003,80241318,80211648,80190859,81650731,81035118,81582615,80096545,81024039,81149450,80099656;True;2
80991107;Séries dramatiques|Films d'époque;Mr. Sunshine;occ-0-2773-2774.1.nflxso.net/dnm/api/v6/6gmvu2hxdfnQ55LZZjyzYR4kzGk/AAAABWuMHBRXvckXkRfqWoVUjDKOW857LzEKYAHIawk5cxjLFCy8Gc1hZYmD9RgkZIdHfkLfCBW3PV91jPNvajph7fMj6QVKdAjweNvXrz_lwJV-oYpOtHrr7S5-zpGe_SsF7J9o.jpg?r=267;2018;24 Épisodes;;16+;Débarqué aux États-Unis en 1871 après l'expédition du Shinmiyangyo, un jeune homme retourne plus tard en Corée où il tombe sous le charme d'une ravissante aristocrate.;violence;0;;Lee Byung-hun,Kim Tae-ri,Yoo Yeon-seok,Byun Yo-han,Kim Min-joung,Kim Gap-soo,Choi Mu-sung,Kim Eui-sung,David Lee McInnis,Kim Byong-chul,Lee Seung-jun,Kang Shin-il,Jo Woo-jin,Lee Ho-jae;;Séries dramatiques romantiques,Séries politiques,Séries dramatiques,Coréen,Films d'époque;Doux-amer,Émotion,Romantique;81610893,81442115,81161487,81239224,81517188,81444051,80986896,81267722,81482476,81260283,81683746,81682438,81568842,80196931,81365087,81669775,81519223,80031790,80188730,81430282,81517168,81159258,81649877,81422314,81116487,81463556;True;2
80991848;Séries US|Séries dramatiques|Séries à regarder sans modération;Sex/Life;occ-0-2773-2774.1.nflxso.net/dnm/api/v6/6gmvu2hxdfnQ55LZZjyzYR4kzGk/AAAABa8GxufFsposGqOzVPKfp-8glMuQQll7UMWunXhUbhYqrOgVneYQj5OM3LGxTbqTpGIH_IgAFEUgPY-b7STXyLb5NImgB-pEyXG017kYNnJcQPrQVHjYdqHbuGzymH3hIDgv.jpg?r=f95;2023;2 Saisons;;18+;Son présent de femme mariée et son passé amoureux licencieux se télescopent quand son ex, sur lequel elle fantasme toujours, fait irruption dans sa vie.;sexe;0;;Sarah Shahi,Mike Vogel,Adam Demos,Margaret Odette;;Séries dramatiques romantiques,Séries dramatiques,Séries inspirées de livres,Séries US;Torride,Intimiste;80131194,81478642,81388078,70167075,80013872,81425117,80095411,70211042,81489770,80211991,81476441,81058385,70294663,81393836,81036622,81513875,81245964,81252980,81498384,81140470,80179190,80197526,81397576,81397579,80057784,80212986;True;3
80992263;Films jeunesse et famille;Chupa;occ-0-2773-2774.1.nflxso.net/dnm/api/v6/6gmvu2hxdfnQ55LZZjyzYR4kzGk/AAAABWqr0f80WkTcqo-kUiycbZntjiuURy4EgdADrxyxJTlNUriWgRNo9KqNZnCYCWcHac7AkUPKS65NDvbIDA6jU_5dB6RTGGlIz4m6BICnCdLblQtXPsxHgT9kQ3OGSCKHXznR.jpg?r=df9;2023;1 h 38 min;;10+;En visite dans sa famille au Mexique, un jeune garçon solitaire s'attache à une créature fantastique qui se cache dans le ranch de son grand-père. L'aventure de sa vie commence !;;0;Jonás Cuarón;Demián Bichir,Evan Whitten,Christian Slater,Ashley Ciarra,Nickolas Verdugo,Adriana Paz,Gerardo Taracena,Julio Cesar Cedillo;Sean Kennedy Moore,Joe Barnathan,Marcus Rinehart,Brendan Bellomo;Films pour la famille,Films jeunesse et famille,Aventures en famille;;80214792,81012821,80172283,80002924,81050106,81026605,81220825,81475311,81018682,70002007,81011712,70298991,80214236,70021640,80200487,70305922,60031264,81427442,70197459,70033005,81607651,80234520,81267965,81023618,70084792,70220028;True;1
80993016;Films jeunesse et famille;Matilda : La comédie musicale;occ-0-2773-2774.1.nflxso.net/dnm/api/v6/6gmvu2hxdfnQ55LZZjyzYR4kzGk/AAAABfHFQ0VwnQCB5UqGRlfrVXdI-jwiCpHASDfTv9i8s9axrl2L2o1ZQN-TSmPRdhEMC4vINZkzjBW92Og0iHFa2Bfi-ZXP1Z2QM26AAwPHyt0EKIX8J1HOCwk9xwnrWyp792PA.jpg?r=6d4;2022;1 h 56 min;;7+;Quand une fillette extraordinaire à l'esprit vif et à l'imagination débordante veut changer le cours de son destin, les résultats dépassent toutes ses espérances. Voici Matilda !;;0;Matthew Warchus;Alisha Weir,Emma Thompson,Lashana Lynch,Stephen Graham,Andrea Riseborough,Sindhu Vee;Dennis Kelly;Films pour la famille,Films jeunesse et famille,Films inspirés d'une pièce de théâtre,Grandir en musique,Films inspirés de livres;Décalé;81028225,80232043,80222822,81220825,80230534;True;1
80993105;Mondes épiques|Blockbusters;Mowgli : la légende de la jungle;occ-0-2773-2774.1.nflxso.net/dnm/api/v6/6gmvu2hxdfnQ55LZZjyzYR4kzGk/AAAABfLfyu35RBn9zRHBxLH5A3FFCvKy0f-LU7lnC9t-HtLcwWS_zEVFMKkzdSRSZnETS3lN3tqXnMXF7LbOsmKjPGP3VBNiLRCiiySsrAstDTn48VPkILuBML2CtVg6HH1J1kmh.jpg?r=457;2018;1 h 44 min;;13+;Un jeune orphelin élevé par des animaux au cœur de la jungle prend en main son destin en affrontant un dangereux ennemi... et sa propre nature humaine.;;0;Andy Serkis;Christian Bale,Cate Blanchett,Benedict Cumberbatch,Naomie Harris,Andy Serkis,Rohan Chand,Peter Mullan,Jack Reynor,Eddie Marsan,Tom Hollander,Louis Ashbourne Serkis,Matthew Rhys,Freida Pinto;Callie Kloves;Films pour la famille,Britannique,Drames pour la famille,Aventures en famille,Films inspirés de livres;Sombre;80992263,80133543,80218885,80017529,80179070,70178621,81161789,81018682,70305899,81245455,81073022,70125931,81165134,60020686,60036256,70119441,81004278,80200487,81030627,80237937,80093133,80179190,60004473,80029196,80119234,80216309;True;2
80993280;Films et séries en français|Films comiques;Babysitting 2;occ-0-2773-2774.1.nflxso.net/dnm/api/v6/6gmvu2hxdfnQ55LZZjyzYR4kzGk/AAAABag7RcjY6izxl-2mI9Dg449AOlJ0TYb2kxCQtyvE1GTWuL8JaCEBae3FRGOo8O2Kf31SQVodDdVwZKnjbj6I1uxFmz_2H2B7He0.webp?r=e54;2015;1 h 32 min;;13+;Franck veut demander Sonia en mariage et rencontre son futur beau-père au Brésil. Mais rien ne se passe comme prévu quand ses amis déjantés partent en excursion.;;0;Nicolas Benamou,Philippe Lacheau;Philippe Lacheau,Alice David,Vincent Desagnat,Tarek Boudali,Julien Arruti,Charlotte Gabris,Valériane de Villeneuve,Élodie Fontan,Elisa Bachir Bey,Christian Clavier,Valérie Karsenti,Jérôme Commandeur,David Marsais;Philippe Lacheau,Julien Arruti,Pierre Lacheau,Nicolas Benamou;Français,Comédies;Absurde,Décalé;80235928,80194671,70244166,81233034,70218756,80171706,81270678,70125231,80158583,81631507,81466149,81663277,81600435,80015343,81191429,80191876,81600424,81088495,80987464,80014749,81212484,80094318,81005311,80057784,81290742;False;2
